question,answer,question_augmented,answer_augmented,topic,type,reference
生物学を二つの文で要約してください,生物学は生命の様々な形質、機能、進化、成長などを研究する自然科学の一分野です。それは生物の基本的な法則を理解し、その知識を人間の健康や環境保全に役立てるための科学です。,生物学は、生命の構造や機能、進化、分布を研究する科学分野で、微生物から人間まで、地球上の全生命体を対象とします。,生物学は、生命の特性や機能、進化、成長などを研究する自然科学の一部門で、その基本的な法則を理解し、人間の健康や環境保全に役立てるための科学です。,Biology,summarization,https://ja.wikipedia.org/wiki/生物学
生物学の重要性や主要な側面について分析してください。,生物学は、自然界を理解するための重要な科学であり、生命の起源、発展、構造、関数についての知識を提供します。また、科学技術の進歩における役割も大きく、新しい治療法や技術の開発に寄与しています。さらに、健康や環境に対する影響も深く、生物学は人間の生活のあらゆる側面において重要な役割を果たします。,生物学の重要性と主要な要素について分析してください。,生物学は生命の起源、発展、構造、機能を解明する重要な科学であり、自然界の理解に不可欠です。科学技術の進歩にも大きく寄与し、新しい治療法や技術の開発に貢献しています。さらに、健康や環境に深く影響を与え、人間生活のあらゆる側面で重要な役割を担っています。,Biology,analysis,https://ja.wikipedia.org/wiki/生物学
日本の経済は世界的にどのような位置付けですか？,日本は世界でも有数の経済大国で、国内総生産(GDP)が非常に高い国として知られています。,日本の経済は世界でどの位置につけていますか？,日本は世界をリードする経済大国の一つで、特に高いGDPを誇っています。,Economy,generic,https://ja.wikipedia.org/wiki/経済
「経済」について2文で要約してください。,日本のGDPは世界第三位で、先進国の中で最も高い経済成長率を誇ります。また、日本は完全雇用を実現し、失業率は非常に低いです。,「経済学」は、人々や社会が限られた資源をどのように利用し、配分するかを研究する学問です。マクロ経済学とミクロ経済学の二つの主要な分野に分けられ、それぞれ経済全体の動きや個々の経済行動を分析します。,日本のGDPは世界第三位で、先進国中最高の経済成長率を誇っています。さらに、完全雇用を達成し、失業率も極めて低い状態を保っています。,Economy,summarization,https://ja.wikipedia.org/wiki/経済
経済の重要性や主要な側面を分析してください。,経済は生活水準を決定し、開発のための必要なインフラとシステムを提供し、国の成長と発展の持続可能性を維持する役割を果たします。経済の主要な側面には、商品やサービスの生産、分配、消費が含まれます。これらは国の経済状態を把握するための重要な指標となります。,経済の重要性と主要な要素について分析してください。,経済は生活水準を決定し、開発に必要なインフラとシステムを提供し、国の成長と発展の持続性を保つ役割を果たします。経済の主要な要素として、商品やサービスの生産、分配、消費があり、これらは国の経済状況を把握するための重要な指標となります。,Economy,analysis,https://ja.wikipedia.org/wiki/経済
3と5の合計は何ですか？,8,3と5を足すと何になりますか？,Could you please provide the Japanese text that needs to be refined?,Mathematics,generic,https://ja.wikipedia.org/wiki/数学
数学を二文で要約してください。,数学は数量、構造、空間、変化などの概念を扱う学問であり、抽象的かつ論理的な視点から問題を解明します。それは自然科学における理論の基礎を形成し、物理法則の表現や技術、経済など多岐にわたる領域で重要な役割を果たしています。,数学とは、数量、構造、空間、変化などの概念を扱う学問であり、論理的な証明を重視します。抽象的な理論から具体的な問題解決まで、その応用範囲は非常に広いです。,数学は、量や構造、空間、変化などの概念を抽象的かつ論理的に扱う学問で、自然科学の理論基盤を形成し、物理法則の表現にも重要な役割を果たします。また、技術や経済など多岐にわたる分野で活用されています。,Mathematics,summarization,https://ja.wikipedia.org/wiki/数学
数学の重要性や主要な側面を分析してください。,数学はエンジニアリング、経済学、物理学など、様々な分野の基盤となる学問です。また、数学は論理的思考や問題解決スキルを向上させる役割も果たしています。,数学の重要性と主要な側面について解析してください。,数学はエンジニアリング、経済学、物理学など多岐にわたる分野の基盤となる学問で、論理的思考や問題解決スキルを鍛える役割も果たします。,Mathematics,analysis,https://ja.wikipedia.org/wiki/数学
日本の書道で必要な道具は何ですか？,書道には、「文房四宝」と呼ばれる筆、墨、紙、硯が必要です。,書道に必要な道具は何ですか？,書道では、「文房四宝」つまり筆、墨、紙、硯が不可欠です。,Art,generic,https://ja.wikipedia.org/wiki/芸術
美術を二文で要約してください。,美術は、絵画、彫刻、パフォーマンスアート、文学などを含む広範な分野です。人間の表現形式であり、文化、感情、またはアイデアを反映しています。,芸術は、人間の感情や考えを表現する手段であり、視覚、聴覚、触覚などを通じて体験されます。それは美的価値を持ち、文化や歴史を反映し、人々の心を動かす力を持っています。,芸術は、絵画、彫刻、パフォーマンスアート、文学など多岐にわたる分野で、文化や感情、アイデアを反映する人間の表現形式です。,Art,summarization,https://ja.wikipedia.org/wiki/芸術
美術の重要性や主要な側面を分析してください。,美術は個々の自己表現の手段であり、創造性と思考力を育て、視覚的な形で物語を伝えます。また、美術は時代や地域の文化を反映し、社会や政治的な問題を提起することができます。そして、美術は感情の表現や人間の経験を共有する手段としても機能します。これらの側面は、美術が人間社会における重要性を示しています。,芸術の重要性と主要な要素について分析してください。,芸術は個々の自己表現や創造性、思考力の育成の手段であり、物語を視覚的に伝える役割も果たします。さらに、異なる時代や地域の文化を映し出し、社会的・政治的な問題を提起することも可能です。感情表現や人間の経験の共有といった機能も持ち、その重要性は人間社会において大いに示されています。,Art,analysis,https://ja.wikipedia.org/wiki/芸術
地球上の重力の力はどれくらいですか？,地球上の重力加速度はおおよそ9.8 m/s²です。これは自由落下する物体が、空気抵抗を無視した場合、毎秒9.8 m/sずつ速度が増加することを意味します。,地球の重力はどれくらいですか？,地球上の重力加速度は約9.8 m/s²で、これは空気抵抗を無視した場合、自由落下する物体の速度が毎秒9.8 m/s増加することを示しています。,Physics,generic,https://ja.wikipedia.org/wiki/物理学
「物理学」を二文で要約してください。,物理学は物質とエネルギー、そしてそれらの相互作用を研究し、宇宙の振る舞いを理解しようとする学問です。これは最小の粒子から宇宙の広大な範囲までのすべてを包括しています。,物理学は、自然現象や宇宙の法則を理解し、数学的に解析する学問です。エネルギー、力、時間、空間などの基本的な概念を扱い、その理論は科学技術の多くの分野に応用されています。,物理学は物質とエネルギーの相互作用を研究し、微粒子から宇宙規模までの全ての振る舞いを理解することを目指しています。,Physics,summarization,https://ja.wikipedia.org/wiki/物理学
「物理学」の重要性や主要な側面を分析してください。,物理学は、自然界を理解するための重要な科学分野です。物質の研究、エネルギー、力、空間、時間などの関連概念を通じて、我々は現象を説明し、予測することができます。これらの主要な側面は、科学的探求の基礎であり、技術の進歩、新たな発見、そして我々の日常生活に影響を与える理論の開発に対する理解を深めるのに役立ちます。,「物理学」の重要性と主要な要素について分析してください。,物理学は自然界の理解に不可欠な科学で、物質やエネルギー、力、空間、時間などの概念を研究します。これらを通じて、現象の説明や予測が可能となり、科学的探求の基盤を築きます。また、技術進歩や新発見を促進し、私たちの日常生活に影響を与える理論の理解を深める役割も果たします。,Physics,analysis,https://ja.wikipedia.org/wiki/物理学
生命の最小の単位は何と呼ばれますか？,細胞,生命の最小単位は何と言われていますか？,"このテキストは既に自然で簡潔であり、明確化する必要はありません。""細胞""はそのままで適切です。",Science,generic,https://ja.wikipedia.org/wiki/科学
量子力学を二つの文で要約してください。,量子力学は物理学の一部で、微視的な粒子の挙動を説明します。それは粒子が同時に複数の状態を持ち、観察されるまでその状態が確定しないという現象を理解するのに必要です。,量子力学は、微視的な粒子の振る舞いを記述する物理学の一分野です。粒子の位置や運動量など、観測可能な物理量は確定的ではなく確率的にしか予測できないという特徴があります。,量子力学は、微視的粒子の振る舞いを解明する物理学の一分野で、粒子が複数の状態を同時に保持し、その状態が観察されるまで確定しないという現象を理解することが求められます。,Science,summarization,https://ja.wikipedia.org/wiki/科学
科学の重要性やその主要な側面について解析してください。,科学は我々が自然界を理解し、それを利用するための基本的な手段です。その主要な側面として、科学的方法論があります。これは観察、仮説の立案、実験、そして結論の形成というプロセスを通じて知識を得る方法です。これにより、我々は客観的で再現可能な結果を得ることができます。また、科学は技術や医療の進歩においても重要な役割を果たしています。新しい科学的知識は、新たな技術や治療法の開発につながることが多いです。したがって、科学は我々の生活の質を向上させ、未来の問題に対処するための道具を提供しています。,科学の重要性と主要な側面について分析してください。,科学は、自然界を理解し利用する基本的な手段で、その核心は科学的方法論です。これは観察、仮説形成、実験、結論形成というプロセスにより知識を得、客観的で再現可能な結果を導き出します。また、科学は技術や医学の進歩に重要な役割を果たし、新たな科学的知識は新技術や治療法の開発につながることが多いです。そのため、科学は生活の質向上や未来の問題解決に必要なツールを提供します。,Science,analysis,https://ja.wikipedia.org/wiki/科学
