question,answer,question_augmented,answer_augmented,topic,type,reference
どのようにして寿司のご飯を作ることができますか？,まず、米をよく洗い、それから適量の水で炊きます。炊き上がったら、酢、砂糖、塩を混ぜ合わせた調味料を加え、全体が均一に混ざるように混ぜます。その後、しっかりと冷まして寿司稲を完成させます。,寿司飯の作り方を教えていただけますか？,まず、米をよく洗い、適量の水で炊きます。炊き上がったら、酢、砂糖、塩を加えて全体が均一になるように混ぜます。その後、しっかり冷まして寿司飯の完成です。,Cooking,generic,https://ja.wikipedia.org/wiki/料理
料理について2文で要約してください。,料理とは、食材を組み合わせ、混ぜ合わせ、加熱することにより食事を準備する過程です。料理は私たちの日常生活で重要な役割を果たし、食べ物をより消化しやすく、安全にする一方、煮沸、焼き、揚げ、蒸し等、様々な調理方法があります。,料理について要約します。料理は食材を加工し、美味しく栄養価の高い食事を作る技術です。また、文化や地域性を反映し、人々をつなげる大切な役割も果たしています。,料理は、食材を組み合わせ、加熱することで食事を作り出す過程です。これは私たちの日常生活に欠かせない役割を果たし、食べ物を消化しやすく、安全に摂取できるようにします。煮る、焼く、揚げる、蒸すなど、多種多様な調理方法が存在します。,Cooking,summarization,https://ja.wikipedia.org/wiki/料理
料理の重要性や主要な側面について分析してください。,料理は健康的でバランスの取れた食事を確保するための重要な手段です。また、それは文化や伝統の一部でもあります。特に日本の料理においては、食材の知識、技術、そしてプレゼンテーションが主要な側面となります。これらの要素は、料理がただの食事を提供するだけでなく、食文化を体現し、感覚的な楽しみを提供する手段であることを示しています。,料理の重要性と主要な要素について分析してください。,料理は健康的でバランスの取れた食事を提供するだけでなく、文化や伝統の一部も表現します。特に日本料理では、食材の知識、技術、プレゼンテーションが重要で、これらは単に食事を提供する以上に、食文化を体現し、感覚的な楽しみを醸し出します。,Cooking,analysis,https://ja.wikipedia.org/wiki/料理
日本で最も高い山は何ですか？,日本で最も高い山は富士山です。,日本で一番高い山は何ですか？,日本の最高峰は富士山です。,Geography,generic,https://ja.wikipedia.org/wiki/地理
「地理」を二つの文で要約してください。,地理学は地球や惑星の土地、特徴、住民、現象を研究する科学の一分野です。主に二つの主要な分野、すなわち物理地理学（物理的特徴とプロセスを扱う）と人文地理学（人間の活動とその影響について）があります。,「地理学」は、地球上の自然環境と人間活動の相互関係を研究する学問です。具体的には、地形、気候、生態系、人間社会の分布や変化を調査し、それらがどのように相互作用するかを理解しようとします。,地理学は、地球や惑星の地形、特性、住民、現象を研究する科学分野で、主に物理地理学（物理的特性やプロセスを扱う）と人文地理学（人間の活動とその影響を研究する）の二つの主要な領域に分けられます。,Geography,summarization,https://ja.wikipedia.org/wiki/地理
地理学の重要性や主要な側面について分析してください。,地理学は、私たちの生活と世界に大きな影響を与えるという点で重要です。まず、地理学は気候に関する理解を深めるのに役立ちます。地域の地理は、そこでの気候や自然災害の種類を左右し、これらは人々の生活スタイルや建築物の形状に影響を与えます。次に、地理的な位置は文化と経済にも影響を与えます。例えば、海に近い地域では海洋活動に関わる文化が発達し、経済活動も海洋資源に依存することが多くなります。また、山間部では森林資源や登山観光が重要な産業となることがあります。このように、地理学は私たちの生活と社会に対する深い理解を可能にします。,地理の重要性と主要な要素について分析してください。,地理は私たちの生活や世界への理解を深める重要な要素です。地理は地域の気候や自然災害の特性を理解する手助けとなり、それが人々の生活スタイルや建築形態に影響を与えます。また、地理的な位置は文化や経済にも影響を及ぼします。例えば、海に近い地域では海洋活動に関連する文化が育ち、経済は海洋資源に依存することが多いです。一方、山岳地域では森林資源や観光が重要な産業となります。このように、地理は私たちの生活や社会についての理解を深めるための鍵となります。,Geography,analysis,https://ja.wikipedia.org/wiki/地理
私たちの太陽系で最大の惑星は何ですか？,木星,太陽系で最大の惑星は何ですか？,このテキストは既に自然で簡潔であり、明確です。そのため、修正の必要はありません。,Astronomy,generic,https://ja.wikipedia.org/wiki/天文学
2文で'天文学'を要約してください。,天文学は、天体、宇宙、物理的な宇宙を研究する科学です。星、惑星、銀河、地球の大気外で発生する現象を研究することを含みます。,「天文学」は、宇宙の現象や天体の動きを研究する学問です。星や惑星、銀河系などの観測や理論を通じて、宇宙の法則や起源を探求します。,天文学は、天体や宇宙、その物理的性質を研究する科学で、星、惑星、銀河、地球大気圏外での現象の調査も含まれます。,Astronomy,summarization,https://ja.wikipedia.org/wiki/天文学
天文学の重要性や主要な側面について分析してください。,天文学は、宇宙と我々の存在について理解するために不可欠な科学です。具体的には、宇宙の構造や起源、星や惑星の動きなど、自然現象の理解に貢献しています。さらに、衛星技術の開発や気候モデルの改善といった実用的な応用もあります。また、天文学は我々が存在や現実の性質について深く思考するきっかけを与え、科学的精神を養う重要な役割も果たしています。,天文学の重要性と主要な特性について分析してください。,天文学は、宇宙の構造や起源、星や惑星の動きといった自然現象を解明し、我々の存在を理解するための重要な科学分野です。衛星技術の開発や気候モデルの改善などの実用的な応用も行っています。さらに、我々の存在や現実の性質について深く考察する機会を提供し、科学的精神を育む役割も果たしています。,Astronomy,analysis,https://ja.wikipedia.org/wiki/天文学
What is the significance of the Japanese tea ceremony?,"The Japanese tea ceremony, also known as 'Chanoyu', 'Sado' or 'Ocha', is a significant aspect of Japanese culture. It's not just about drinking tea, it's a spiritual and aesthetic discipline for refinement of the self, known as the 'Way of Tea'. The tea ceremony represents four key principles: harmony, respect, purity, and tranquility. Every aspect of the ceremony, from the preparation and presentation of the tea, to the architecture of the tea house, is deeply rooted in Zen Buddhism.",茶道の意義は何ですか？,「茶道」または「茶の湯」は、日本文化の重要な一部で、単にお茶を飲むだけでなく、自己研鑽の精神的・美的な規律、「茶の道」とも言えます。和、敬、清、寂の四原則を体現し、茶の準備から提供、茶室の設計に至るまで、全てが禅仏教に深く根ざしています。,Culture,generic,https://ja.wikipedia.org/wiki/文化
'文化'について2文で要約してください。,文化は、特定の社会やグループの生活様式、価値観、慣習などを包括する概念です。それは人々の世界観を形成し、思考と行動の指針を提供する重要な役割を果たします。,「文化」は、特定の社会や集団が共有する価値観、慣習、芸術などを指します。これは、その集団の歴史や経験を通じて形成され、世代から世代へと伝えられます。,文化とは、特定の社会やグループの生活様式、価値観、慣習等を含む概念で、人々の世界観を形成し、思考や行動の指針を提供する重要な役割を担っています。,Culture,summarization,https://ja.wikipedia.org/wiki/文化
日本の文化の重要性や主要な側面を分析してください。,日本文化の重要性は、その独自性と影響力にあります。長い歴史と伝統、芸術、自然との調和といった要素が組み合わさり、ユニークで魅力的な文化を作り出しています。また、日本の文化は世界に広く認知されており、アニメやマンガ、料理、技術など、多くの分野で影響力を持っています。日本の文化は礼儀正しさ、尊敬、和、そして持続可能性といった価値観を体現しています。これらは、日本社会のコミュニケーションや行動の基礎を形成しており、その意味で日本の文化は非常に重要です。,日本文化の重要性と主要な要素について分析してください。,日本文化の価値は、その独特さと影響力にあります。長い歴史と伝統、芸術、自然との調和が融合し、魅力的な文化を生み出しています。また、アニメ、マンガ、料理、技術など、世界中で認知され、多大な影響を及ぼしています。礼儀正しさ、尊敬、調和、持続可能性といった価値観を体現し、これらは日本社会のコミュニケーションと行動の基盤を築いています。そのため、日本文化の重要性は計り知れません。,Culture,analysis,https://ja.wikipedia.org/wiki/文化
URLの全称は何ですか？,URLの全称はUniform Resource Locatorです。,URLの正式な名称は何ですか？,URLの正式な名称は「Uniform Resource Locator」です。,Technology,generic,https://ja.wikipedia.org/wiki/技術
技術を二文で要約してください。,技術は人間の問題を解決し、私たちの願望を満たすための道具、機械、材料、プロセスの開発と適用を含む広範な分野です。これは毎日新しい進歩と革新が起こる、絶えず進化する分野です。,この技術を二文で簡潔にまとめてください。,テクノロジーは、人間の問題解決や願望達成のための道具、機械、材料、プロセスの開発や応用を含む広範な領域で、日々新たな進歩と革新が生まれ、絶えず進化しています。,Technology,summarization,https://ja.wikipedia.org/wiki/技術
テクノロジーの重要性や主要な側面について分析してください。,テクノロジーは現代社会において極めて重要な役割を果たしています。産業、経済、コミュニケーションの進化において中心的な役割を果たし、生活の多くの側面を形成しています。テクノロジーは生産性を向上させ、資源を効率的に利用し、より優れた製品やサービスを提供することにより、経済成長を推進します。また、テクノロジーは情報の伝達を容易にし、全世界の人々とのコミュニケーションを可能にします。近年では、AIやIoTなどの新技術が社会の様々な問題を解決する可能性を秘めており、テクノロジーの進化がこれからの世界を形成する重要な要素となるでしょう。,テクノロジーの重要性と主要な要素について分析してください。,テクノロジーは現代社会で欠かせない役割を担っています。産業、経済、通信の進歩を牽引し、私たちの生活を形成しています。生産性の向上、資源の効率的な利用、優れた製品やサービスの提供により、経済成長を推進します。また、情報伝達を容易にし、世界中の人々とのコミュニケーションを可能にします。AIやIoTのような新技術は、様々な社会問題の解決に寄与する可能性を秘めており、テクノロジーの進化は未来の世界を形成する重要な要素となるでしょう。,Technology,analysis,https://ja.wikipedia.org/wiki/技術
アスピリンの主な使用目的は何ですか？,アスピリンは主に痛みを和らげる、発熱と炎症を減らすために使用されます。また、心筋梗塞と脳卒中のリスクを減らす抗血小板剤としてもよく使用されます。,アスピリンの主な用途は何ですか？,アスピリンは痛みを和らげたり、発熱や炎症を軽減するために使われます。さらに、心臓発作や脳卒中のリスクを下げる抗血小板剤としても広く用いられています。,Medicine,generic,https://ja.wikipedia.org/wiki/医学
二つの文で「医学」を要約してください。,医学は病気の予防、診断、治療、および患者のケアに関連する科学的な知識と技術の分野です。この学問は、人間の健康を維持・改善し、生活の質を向上させるために設計されています。,「医学」は、人間の健康を維持・回復するための知識や技術を研究する学問です。病気の予防、診断、治療、そして健康の維持に関する広範な領域をカバーしています。,医学は、予防、診断、治療、患者ケアに関する科学的知識と技術の領域で、人間の健康維持・改善と生活の質向上を目指す学問です。,Medicine,summarization,https://ja.wikipedia.org/wiki/医学
医学の重要性や主要な側面を分析してください。,医学は健康と福祉の促進、疾病の予防と治療、病気の早期検出と治療、寿命の延長に大きく貢献する重要な分野です。医学の主要な側面には、疾病の診断、治療、予防、患者ケア、医療研究などが含まれます。,医学の重要性と主要な側面について分析していただけますか。,医学は、健康と福祉の向上、疾病の予防と治療、早期発見と寿命の延長に大きく寄与する重要な分野です。主な要素として、疾病の診断、治療、予防、患者ケア、医学研究があります。,Medicine,analysis,https://ja.wikipedia.org/wiki/医学
Who is the author of the novel 'Norwegian Wood'?,The author of the novel 'Norwegian Wood' is Haruki Murakami.,「ノルウェイの森」の著者は誰ですか？,「ノルウェイの森」の著者は村上春樹です。,Literature,generic,https://ja.wikipedia.org/wiki/文学
文学を2文で要約してください。,文学は、小説、詩、劇などの書かれた作品を探求し分析する学問です。それは人間の経験や感情を表現し、読者に深い洞察と理解を提供します。,文学を二文で簡潔に要約してください。,文学は小説、詩、戯曲などの作品を学術的に研究するもので、人間の経験や感情を表現し、読者に深遠な洞察と理解をもたらします。,Literature,summarization,https://ja.wikipedia.org/wiki/文学
文学の重要性またはキーアスペクトを分析してください。,文学は文化や個人の経験を伝える手段であり、想像力や批判的思考を刺激する役割も果たします。さらに、社会に影響を与える可能性もあります。それぞれの作品は時代背景や作者の視点を反映しており、読者に深い洞察を提供します。また、文学は言語の美しさと力を示すための手段でもあります。これらの要素は文学の重要性とキーアスペクトを形成しています。,文学の重要性や主要な要素について分析してください。,文学は文化や個人の経験を伝え、想像力や批判的思考を刺激するだけでなく、社会に影響を及ぼす可能性も秘めています。各作品は歴史的背景と著者の視点を反映し、読者に深遠な洞察を提供します。さらに、文学は言語の美と力を示す手段でもあり、これらの要素が文学の重要性と主要な側面を形成しています。,Literature,analysis,https://ja.wikipedia.org/wiki/文学
What is the name of the period in Japanese history characterized by the rule of the Tokugawa shogunate?,Edo period,江戸時代とは、日本の歴史上、徳川幕府による統治が特徴的だった時期の名称ですか？,"このテキストはすでに自然で簡潔、明瞭な表現となっています。""江戸時代""とは、日本の歴史上の一時期を指す言葉であり、特に修正する点はありません。",History,generic,https://ja.wikipedia.org/wiki/歴史
「歴史」を二文で要約してください。,歴史は過去の出来事を研究する学問で、先史時代から現代までの人類の活動を対象としています。それは過去の文化、文明、事件を分析することで、現在と未来の理解に深い洞察を提供します。,「歴史」を二文で要約するようお願いします。,歴史は、先史時代から現代までの人間活動を研究する学問で、過去の文化や文明、出来事の分析を通じて現在と未来を理解する深い洞察を提供します。,History,summarization,https://ja.wikipedia.org/wiki/歴史
明治維新の重要性や主要な側面を分析してください。,明治維新は、日本の封建的な幕府体制を終わり、近代化と産業化への道を開いた重要な時期です。この期間は、西洋の技術と思想の導入により、日本の社会、政治、経済が大きく変わりました。明治維新は、日本が世界の強国として台頭するための基盤を築きました。,「明治維新の重要性と主要な要点について分析してください。」,明治維新は、封建的な幕藩体制を終結させ、近代化と産業化への道を切り開いた重要な時期です。この時代、西洋の技術やアイデアの導入により、日本の社会、政治、経済は大きく変革されました。明治維新は、日本が世界の大国へと台頭する基盤を築き上げました。,History,analysis,https://ja.wikipedia.org/wiki/歴史
シャミセンは何という種類の楽器ですか？,シャミセンは、三つの弦がある伝統的な日本の楽器で、バチと呼ばれるプレクトラムで演奏します。,三味線はどのような楽器なのでしょうか？,三味線は、伝統的な日本の楽器で、3本の弦をバチという道具で奏でます。,Music,generic,https://ja.wikipedia.org/wiki/音楽
'音楽'を二つの文で要約してください。,音楽は感情やアイデアを伝えるための世界共通の形式で、リズム、メロディ、和音、音色などの要素を用いています。それはエンターテイメント、コミュニケーション、儀式など、人間社会のさまざまな文脈で使用され、重要な役割を果たしています。,「音楽」は、様々な音を組み合わせて表現される芸術形式です。感情や思想を伝える手段として、世界中の文化で広く利用されています。,音楽はリズム、メロディー、ハーモニー、音色などを駆使し、感情やアイデアを表現する普遍的な手段です。エンターテイメント、コミュニケーション、儀式など、人間社会の多様な場面で活用され、重要な役割を担っています。,Music,summarization,https://ja.wikipedia.org/wiki/音楽
音楽の重要性や主要な側面について分析してください。,音楽は多くの面で非常に重要です。感情的な側面では、音楽は感情を表現し、共有する重要な手段として機能します。また、音楽は文化的な意味合いも持っています。音楽は文化の一部を形成し、伝統や価値を伝え、人々が自分たちのアイデンティティを理解し表現する手段です。さらに、音楽は社会的な側面も持っています。音楽は人々をまとめる力があり、共同体を形成し、人々が一緒に経験を共有することを可能にします。そして最後に、音楽はその多様性と広がりにおいても重要です。音楽は多くの異なるジャンル、スタイル、伝統が存在し、それぞれが独自の美しさと価値を持っています。,音楽の重要性と主要な要素について分析してください。,音楽は多方面で極めて重要です。感情的には、音楽は感情の表現や共有の手段となります。また、文化的な意義も持ち、文化の一部を形成し、伝統や価値を伝えるとともに、自己アイデンティティの理解や表現の手段ともなります。さらに、音楽は社会的な結束力を持ち、コミュニティを形成し、共有体験を生み出します。そして、音楽の多様性と広範囲性も重要な要素です。様々なジャンルやスタイル、伝統が存在し、それぞれが独自の美しさと価値を持つのです。,Music,analysis,https://ja.wikipedia.org/wiki/音楽
日本の科学者が初めて報告した元素、ニホニウムの原子番号は何ですか？,ニホニウムの原子番号は113です。,ニホニウムの原子番号は何でしょうか？これは日本の科学者が初めて発見した元素です。,ニホニウムの原子番号は113番です。,Chemistry,generic,https://ja.wikipedia.org/wiki/化学
化学を二文で要約してください。,化学は物質の構成、性質、変化、そしてその反応について研究する科学分野です。日常生活から宇宙まで、私たちが存在する全てのものは化学の理解によって説明可能で、新しい物質や薬の開発にもつながります。,化学は物質の性質や構造、変化とその原因を研究する科学分野で、元素と化合物の相互作用を通じて物質の構成や反応を解明します。,化学は物質の組成や性質、変化、反応を研究する科学分野で、日常生活から宇宙に至るまで、私たちの周囲の全てが化学の理解により説明可能です。また、それは新たな物質や薬品の開発にも寄与します。,Chemistry,summarization,https://ja.wikipedia.org/wiki/化学
化学の重要性やキーアスペクトを分析してください。,化学は、物質とその反応についての学問で、日常生活、科学、産業などあらゆる側面で重要な役割を果たしています。例えば、医療では薬物の開発、環境保護では汚染物質の分析と除去、産業では新しい材料やエネルギー源の開発などに化学が使われます。また、物質の性質や反応メカニズムを理解することで、私たちは自然界や宇宙を理解する手がかりを得ることができます。これらが化学のキーアスペクトであり、その重要性を示しています。,化学の重要性と主要な要素について分析してください。,化学は物質とその反応を研究し、日常生活から科学、産業まで幅広い分野で重要な役割を担っています。医学での薬物開発、環境保護での汚染物質の分析・除去、産業での新素材やエネルギー源の開発などに活用されています。また、物質の性質や反応機構を理解することは、自然や宇宙の理解にも寄与します。これらが化学の重要性を示す一面です。,Chemistry,analysis,https://ja.wikipedia.org/wiki/化学
クロロフィルの主な機能は何ですか？,クロロフィルの主な機能は光合成に必要な光を吸収することです。,クロロフィルの主要な機能は何ですか？,クロロフィルの主要な機能は、光合成に必要な光の吸収です。,Biology,generic,https://ja.wikipedia.org/wiki/生物学
