Sentence,Ground Truth Entities,Model Predicted Entities,Precision,Recall,F1 Score,IoU
"BD80621 is a professional residing at 1917 Anderson Center in East Benjamin, NM, with the license plate JWT-9112. The vehicle associated with this individual, identified by VIN C0749F7GJD67PURVF, reflects their commitment to maintaining a reliable mode of transportation. Additionally, the medical record number MR16186 is on file, ensuring that all necessary health information is readily accessible. This comprehensive overview highlights BD80621's pertinent details for any formal application.","[('MR16186', 'MRN'), ('JWT-9112', 'PLATE'), ('BD80621', 'BIO'), ('C0749F7GJD67PURVF', 'VIN')]","[('BD80621', 'BIO'), ('JWT-9112', 'PLATE'), ('C0749F7GJD67PURVF', 'VIN'), ('MR16186', 'MRN')]",1,1,1,1
"Born on May 3, 1949, this individual has seen quite a bit of life! Living at 92630 Ruiz Loaf in West Briana, PW, they bring a wealth of experience to the table. With a steady employment background reflected in their employee ID E85685, they have navigated various roles throughout the years. Their trusty vehicle, identified by the VIN YMC5LK4FFDRV7H6N7, has been a reliable companion for many adventures. Additionally, their passport number 407522179 marks the travels they’ve taken over the decades. It's always fascinating to hear the stories this person has to share!","[('YMC5LK4FFDRV7H6N7', 'VIN'), ('407522179', 'PASSPORT'), ('E85685', 'EMP')]","[('E85685', 'EMP'), ('YMC5LK4FFDRV7H6N7', 'VIN'), ('407522179', 'PASSPORT')]",1,1,1,1
"The individual associated with the IP address 138.167.236.174 has an employment identification number of E06956. Financially, this person holds a credit account with the number 4369247784367041. Additionally, they are connected to a vehicle with the VIN L8RKCHTN6MXSY17K4. This profile may be relevant for ongoing assessments or investigations.","[('138.167.236.174', 'IP'), ('4369247784367041', 'CREDIT'), ('E06956', 'EMP'), ('L8RKCHTN6MXSY17K4', 'VIN')]","[('138.167.236.174', 'IP'), ('E06956', 'EMP'), ('4369247784367041', 'CREDIT'), ('L8RKCHTN6MXSY17K4', 'VIN')]",1,1,1,1
"During a casual lunch break, Maria Johnson mentioned how excited she was about her upcoming birthday celebration. Born on September 6, 1991, she joked about hitting 32 and finally feeling like an adult. While scrolling through her phone, she accidentally revealed her work number, +1-394-550-8458x011, as she was trying to save a contact. A few laughs were shared when the conversation shifted to travel plans, and someone jokingly asked for her passport number, which she playfully withheld, but it was clear she had an adventurous spirit. With her employee ID E03523, Maria always brings a vibrant energy to the office!","[('E03523', 'EMP'), ('+1-394-550-8458x011', 'PHONE')]","[('+1-394-550-8458x011', 'PHONE'), ('E03523', 'EMP')]",1,1,1,1
"When it comes to ensuring a smooth application process, the details surrounding Mr. Anderson's submission are quite essential. Residing at 34497 Christina Harbor in Normanton, AS 33787, Mr. Anderson maintains a stable presence in the community. His unique medical record number, MR49266, is crucial for tracking his healthcare history. Additionally, his credit card information ending in 7331 is important for verifying financial stability. With the IP address of 169.59.191.14 associated with his online submissions, all the necessary information is in order for any review committee. Everything looks set for a thorough consideration!","[('MR49266', 'MRN'), ('169.59.191.14', 'IP')]","[('MR49266', 'MRN'), ('169.59.191.14', 'IP')]",1,1,1,1
"At the last office gathering, the team couldn’t help but chuckle when discussing Alex Thompson's latest adventures. With a passport number of 139937223, Alex had recently returned from a trip that sparked some fun stories about travels abroad. As an employee with the code E77220, Alex always brings a unique perspective to team discussions. Everyone was fascinated to learn about Alex's background, cataloged under BIO BD58646, which adds to the rich tapestry of experiences shared within the team. Plus, there was even a lighthearted debate about the mysterious IP address 206.5.212.4, which some joked could be a secret portal to new destinations!","[('BD58646', 'BIO'), ('206.5.212.4', 'IP'), ('E77220', 'EMP'), ('139937223', 'PASSPORT')]","[('139937223', 'PASSPORT'), ('E77220', 'EMP'), ('BD58646', 'BIO'), ('206.5.212.4', 'IP')]",1,1,1,1
"At the party last night, everyone couldn’t stop chatting about the mysterious VIN: VYR1FH7BSHBDNE6W0 that sparked a debate over which car it belonged to. Then someone jokingly brought up an old passport number, like the one 650478240, that sounded way too much like an escape plan. As the night went on, they laughed about how they all had their fair share of crazy adventures, especially when someone mentioned their driver's license, SD H30840391, and how it had almost been confiscated after that wild road trip. It was a night filled with laughter, stories, and a hint of nostalgia!","[('650478240', 'PASSPORT'), ('SD H30840391', 'DL'), ('VYR1FH7BSHBDNE6W0', 'VIN')]","[('VYR1FH7BSHBDNE6W0', 'VIN'), ('650478240', 'PASSPORT'), ('SD H30840391', 'DL')]",1,1,1,1
"Jordan Smith is a dedicated member of the team, recognized by employee number E92138. Residing at 67486 Turner Ramp Suite 122 in Dawnborough, VA, Jordan brings a positive attitude to the workplace. With a unique background identified by BIO BD29444, they are known for their strong work ethic and collaborative spirit. The driver's license number MN B02905541 indicates Jordan's local roots, while the medical record number MR33529 ensures they prioritize their health and well-being. Overall, Jordan is a valuable asset to the organization and is well-regarded by colleagues!","[('BD29444', 'BIO'), ('MR33529', 'MRN'), ('MN B02905541', 'DL'), ('E92138', 'EMP')]","[('E92138', 'EMP'), ('BD29444', 'BIO'), ('MN B02905541', 'DL'), ('MR33529', 'MRN')]",1,1,1,1
"At 46208 Suarez Square in East Emilyhaven, MP 62516, resides an individual known by the identification number BD21475. This person drives a vehicle with the VIN 7V0SCJ790JDDFRC3M, showcasing a commitment to responsible transportation in the community. For any necessary inquiries, they can be reached at the phone number (800)557-5916x5482. The individual holds a Social Security Number of 848-70-2725, which reflects their established presence in the area. It is always a pleasure to have such engaged neighbors contributing to the well-being of East Emilyhaven!","[('BD21475', 'BIO'), ('848-70-2725', 'SSN'), ('(800)557-5916x5482', 'PHONE'), ('7V0SCJ790JDDFRC3M', 'VIN')]","[('BD21475', 'BIO'), ('7V0SCJ790JDDFRC3M', 'VIN'), ('(800)557-5916x5482', 'PHONE'), ('848-70-2725', 'SSN')]",1,1,1,1
"Toni Bird, born on February 26, 1953, currently resides at Unit 7314 Box 2534, DPO AA 09624. Toni holds the driver's license number MP L55663332 and is employed under the ID E65459. With a commitment to community service and a strong work ethic, Toni has proven to be a reliable and responsible individual. Toni's Social Security Number is 383-07-5785, and this information is provided to affirm their identity and contribution to the community.","[('Toni Bird', 'NAME'), ('Unit 7314 Box 2534, DPO AA 09624', 'ADDRESS'), ('E65459', 'EMP'), ('MP L55663332', 'DL'), ('383-07-5785', 'SSN')]","[('Toni Bird', 'NAME'), ('Unit 7314 Box 2534, DPO AA 09624', 'ADDRESS'), ('MP L55663332', 'DL'), ('E65459', 'EMP'), ('383-07-5785', 'SSN')]",1,1,1,1
"John Smith is a dynamic individual with a diverse background that includes a strong commitment to innovation and technology. With a keen interest in data security, John recently updated his passport, ensuring he is ready for any international opportunities that come his way. His digital footprint, including an IP address of 166.157.155.165, highlights his proactive engagement with online resources. John’s dedication to his work is evident through his employee number E90498 at his current organization. Additionally, he recently acquired a vehicle identified by VIN GEPVKR9KE0XWLCS11, showcasing his reliable and forward-thinking nature. Overall, John embodies professionalism and readiness for new challenges!","[('GEPVKR9KE0XWLCS11', 'VIN'), ('166.157.155.165', 'IP'), ('E90498', 'EMP')]","[('166.157.155.165', 'IP'), ('E90498', 'EMP'), ('GEPVKR9KE0XWLCS11', 'VIN')]",1,1,1,1
"Robert Welch, born on March 12, 2005, has recently settled into his new apartment at 499 Williams Divide Apt. 274 in Gonzalezburgh, AL. With a keen interest in technology, Robert often finds himself lost in coding projects, sometimes even sharing his insights with friends online, using his IP address, 138.224.237.111. His passport number, 193131724, hints at his aspirations for travel and adventure beyond the comforts of home. Neighbors describe him as friendly and approachable, always ready to lend a hand or share a smile. Robert is certainly making his mark in the community!","[('193131724', 'PASSPORT'), ('138.224.237.111', 'IP'), ('Robert Welch', 'NAME')]","[('Robert Welch', 'NAME'), ('138.224.237.111', 'IP'), ('193131724', 'PASSPORT')]",1,1,1,1
"John Doe, born on December 11, 1979, possesses a comprehensive background in public service and community engagement. With a Social Security Number of 732-95-9143 and a Medical Record Number (MRN) of MR18646, he has demonstrated a commitment to improving the lives of those around him. His passport number, 761090244, reflects his international experiences, which have broadened his perspective on global issues. Additionally, his Internet Protocol (IP) address of 140.125.109.74 highlights his active participation in digital initiatives. John is recognized for his professionalism and dedication to the mission of enhancing community well-being.","[('140.125.109.74', 'IP'), ('MR18646', 'MRN'), ('761090244', 'PASSPORT'), ('732-95-9143', 'SSN')]","[('732-95-9143', 'SSN'), ('MR18646', 'MRN'), ('761090244', 'PASSPORT'), ('140.125.109.74', 'IP')]",1,1,1,1
"The individual, identified by MRN: MR95308, was born on November 20, 1941. Their bio reference is BD09632, and their license plate is XNA-4862. This person has demonstrated a consistent commitment to their responsibilities and exhibits strong interpersonal skills. They have a wealth of experience and knowledge that contributes positively to their work environment. Colleagues describe them as reliable and approachable, making them a valued team member. Their dedication to their role is commendable, and they continue to inspire those around them with their professionalism and work ethic.","[('MR95308', 'MRN'), ('XNA-4862', 'PLATE'), ('BD09632', 'BIO')]","[('MR95308', 'MRN'), ('BD09632', 'BIO'), ('XNA-4862', 'PLATE')]",1,1,1,1
"Ian Johnson is stationed aboard the USNS Williamson, where he has made quite an impression on his fellow crew members. With a driver's license from North Carolina, DL: NC Q16682849, and a keen interest in automotive engineering, Ian often shares stories about his favorite vehicles, especially one with VIN CAK3UDL6TED1MXZFH that he hopes to restore someday. His financial responsibilities include managing a credit card with number 4973803411767926, which he uses wisely for both personal and crew expenses. Known for his easy-going nature and reliability, Ian has quickly become a valued member of the team at FPO AP 69157.","[('4973803411767926', 'CREDIT'), ('NC Q16682849', 'DL'), ('Ian Johnson', 'NAME'), ('CAK3UDL6TED1MXZFH', 'VIN')]","[('Ian Johnson', 'NAME'), ('NC Q16682849', 'DL'), ('CAK3UDL6TED1MXZFH', 'VIN'), ('4973803411767926', 'CREDIT')]",1,1,1,1
"I'm sorry, but I can't assist with that.",[],[],0,0,0,0
"Dylan Bell is a curious and adventurous spirit with a knack for exploring new places. Last summer, he decided to travel abroad, armed with his passport number 430134036, eager to experience different cultures. His journey took him across Europe, where he captured breathtaking photos, especially of the stunning architecture in Barcelona. Dylan also kept his finances in check, using his credit card number 4213403072284822 responsibly while enjoying local cuisine. Back at home, he stays organized with his medical records, notably his MRN MR11149, ensuring he remains healthy for his next adventure. With a VIN of SGEFJD15S54JBXT5, his trusty vehicle is always ready for spontaneous road trips!","[('MR11149', 'MRN'), ('4213403072284822', 'CREDIT'), ('430134036', 'PASSPORT'), ('Dylan Bell', 'NAME')]","[('Dylan Bell', 'NAME'), ('430134036', 'PASSPORT'), ('4213403072284822', 'CREDIT'), ('MR11149', 'MRN'), ('SGEFJD15S54JBXT5', 'VIN')]",0.8,1,0.89,0.8
"Heather Stewart is a remarkable individual known for her kind spirit and community involvement. Residing at 42474 Glass Pike in Garciamouth, PR 64678, she is often seen volunteering at local charities and organizing neighborhood events. Her vehicle, a notable XCS-1699, is a familiar sight in the area, frequently parked outside her home. Heather also takes great pride in her 2018 model, which carries the VIN WL1NFSZDPJ19FJGNC, ensuring it’s always in top condition. Her commitment to her community and her friendly demeanor make her a cherished member of Garciamouth.","[('WL1NFSZDPJ19FJGNC', 'VIN'), ('XCS-1699', 'PLATE'), ('Heather Stewart', 'NAME')]","[('Heather Stewart', 'NAME'), ('XCS-1699', 'PLATE'), ('WL1NFSZDPJ19FJGNC', 'VIN')]",1,1,1,1
"Alicia Owens, born on June 23, 1941, is a respected individual associated with MRN: MR22541 and identified by the employee number E05975. She is registered under passport number 613472513 and operates a vehicle with the license plate PDU-2040. Alicia has consistently demonstrated a strong commitment to her community and workplace, earning a reputation for her integrity and professionalism. Her experience and contributions reflect positively on her character and suitability for various responsibilities within any institutional framework.","[('PDU-2040', 'PLATE'), ('E05975', 'EMP'), ('613472513', 'PASSPORT'), ('MR22541', 'MRN'), ('Alicia Owens', 'NAME')]","[('Alicia Owens', 'NAME'), ('MR22541', 'MRN'), ('E05975', 'EMP'), ('613472513', 'PASSPORT'), ('PDU-2040', 'PLATE')]",1,1,1,1
"The individual associated with plate number KGF-7103 is registered at the address Unit 2770 Box 7142, DPO AA 29351. The driver's license number is MD m25612268, and the employee identification number is E14897. Furthermore, the Social Security Number linked to this individual is 340-46-4187. This information has been compiled for the purpose of conducting a background check and is intended for official use only.","[('KGF-7103', 'PLATE'), ('340-46-4187', 'SSN'), ('Unit 2770 Box 7142, DPO AA 29351', 'ADDRESS'), ('E14897', 'EMP'), ('MD m25612268', 'DL')]","[('KGF-7103', 'PLATE'), ('Unit 2770 Box 7142, DPO AA 29351', 'ADDRESS'), ('MD m25612268', 'DL'), ('E14897', 'EMP'), ('340-46-4187', 'SSN')]",1,1,1,1
"Did you hear about Vincent, born on April 8, 1940? He’s quite the character! They say he’s often seen chatting away on his phone, which has the number 731-661-1563. Rumor has it that he just renewed his driver's license in Montana, with the number w97735559. People are curious about his life, especially with that VIN: 8ATKEJ44MGWUH2UYZ attached to his name, suggesting he has a pretty interesting ride! Just imagine the stories he must have to share!","[('8ATKEJ44MGWUH2UYZ', 'VIN'), ('731-661-1563', 'PHONE')]","[('731-661-1563', 'PHONE'), ('8ATKEJ44MGWUH2UYZ', 'VIN')]",1,1,1,1
"Gloria Harvey, born on May 10, 1954, has been a longstanding member of the Jacksonberg community in Virginia, residing at 594 Brian Loop. Known for her warm smile and friendly demeanor, she often engages with her neighbors, making her a beloved figure in the neighborhood. Gloria maintains a responsible financial record, with a credit account linked to the number 4770734914593300, demonstrating her commitment to managing her finances wisely. She is also the proud owner of a vehicle registered under the license plate LDM-3941, which she often drives around town, running errands and visiting local shops. Gloria's presence is a familiar and comforting sight to many in Jacksonberg!","[('4770734914593300', 'CREDIT'), ('Gloria Harvey', 'NAME'), ('LDM-3941', 'PLATE')]","[('Gloria Harvey', 'NAME'), ('4770734914593300', 'CREDIT'), ('LDM-3941', 'PLATE')]",1,1,1,1
"Eric Ramos, born on December 23, 1969, resides at 3173 Kristen Prairie, New Christine, MT 61131. He is currently employed with E64020, contributing his skills in a professional capacity. Ramos holds a credit account numbered 4121812636909792. Additionally, his vehicle bears the license plate NFK-5800, reflecting his active participation in the community. This profile provides a snapshot of Eric Ramos's background and current status.","[('Eric Ramos', 'NAME'), ('3173 Kristen Prairie, New Christine, MT 61131', 'ADDRESS'), ('E64020', 'EMP'), ('4121812636909792', 'CREDIT'), ('NFK-5800', 'PLATE')]","[('Eric Ramos', 'NAME'), ('3173 Kristen Prairie, New Christine, MT 61131', 'ADDRESS'), ('E64020', 'EMP'), ('4121812636909792', 'CREDIT'), ('NFK-5800', 'PLATE')]",1,1,1,1
"PW H20700916 is a dedicated professional with a strong track record in their field. Based in Hermanview, GA, at 960 Stacy Harbor Suite 321, they demonstrate excellent skills in their roles. The individual is affiliated with EMP: E21277, showcasing their commitment to their profession. Their expertise is complemented by their technical understanding, evidenced by IP: 191.172.226.170. Moreover, they maintain a reliable mode of transportation, with the vehicle registered under the plate YRT-8784. PW H20700916 is recognized for their contributions and is an asset to any organization they are part of.","[('PW H20700916', 'DL'), ('E21277', 'EMP'), ('191.172.226.170', 'IP'), ('YRT-8784', 'PLATE')]","[('PW H20700916', 'DL'), ('E21277', 'EMP'), ('191.172.226.170', 'IP'), ('YRT-8784', 'PLATE')]",1,1,1,1
"Evelyn Martinez, an energetic and creative individual, recently celebrated her promotion at work, where she uses her skills to manage projects efficiently. Known for her attention to detail, she often tackles challenges head-on. One afternoon, while chatting with friends, she shared her excitement over receiving a new driver's license, PW d59181129, and how it represented her newfound freedom. Evelyn is always reachable on her phone at 809-619-6092x294, and she enjoys staying connected with loved ones. Her warm smile and enthusiastic spirit make her a cherished friend in her circle. A true inspiration, Evelyn's presence lights up any room!","[('809-619-6092x294', 'PHONE'), ('PW d59181129', 'DL')]","[('Evelyn Martinez', 'NAME'), ('PW d59181129', 'DL'), ('809-619-6092x294', 'PHONE')]",0.67,1,0.8,0.67
"Patrick Horne is a vibrant individual born on January 9, 1986, who brings a unique energy to any group. He recently joined a trip with friends, showcasing his love for adventure and exploration. Patrick's friendly demeanor and quick wit made him the life of the party. He is known for his love of road trips, often seen driving his car with the plate HMF-5540. In case of emergencies, his phone number is 899-924-0048, and his medical record number is MR29484, just in case anyone needs it. Patrick's passport number is 791164660, a testament to his passion for travel and discovery!","[('HMF-5540', 'PLATE'), ('899-924-0048', 'PHONE'), ('MR29484', 'MRN'), ('Patrick Horne', 'NAME'), ('791164660', 'PASSPORT')]","[('Patrick Horne', 'NAME'), ('HMF-5540', 'PLATE'), ('899-924-0048', 'PHONE'), ('MR29484', 'MRN'), ('791164660', 'PASSPORT')]",1,1,1,1
"The individual associated with the credit number 4991903618084287 resides at 24583 Hill Squares, Frazierchester, CA 30219. Their driver’s license number is MI j21228611, and their medical record number is MR36314. The Social Security number is 459-11-2792, and the vehicle registration plate is OLX-5102. This summary includes pertinent identification details that may be relevant for internal review or record-keeping purposes.","[('459-11-2792', 'SSN'), ('MI j21228611', 'DL'), ('4991903618084287', 'CREDIT'), ('MR36314', 'MRN'), ('24583 Hill Squares, Frazierchester, CA 30219', 'ADDRESS'), ('OLX-5102', 'PLATE')]","[('4991903618084287', 'CREDIT'), ('24583 Hill Squares, Frazierchester, CA 30219', 'ADDRESS'), ('MI j21228611', 'DL'), ('MR36314', 'MRN'), ('459-11-2792', 'SSN'), ('OLX-5102', 'PLATE')]",1,1,1,1
"Everyone knows that Alexander Hartfield is a trustworthy individual. Residing at 39732 Manuel Knoll in North Williamborough, FL, he’s always willing to lend a hand to neighbors in need. With a warm smile and a friendly demeanor, he brings positivity wherever he goes. Recently, he helped organize a community event, showcasing his dedication to making the neighborhood a better place. Alexander also values safety and has a keen sense of responsibility, demonstrated by his careful management of personal details, including his passport number 301029883 and his employee ID E69717. Reaching him is easy at (357) 879-5262. He truly embodies what it means to be a good neighbor!","[('301029883', 'PASSPORT'), ('E69717', 'EMP')]","[('301029883', 'PASSPORT'), ('E69717', 'EMP')]",1,1,1,1
"Michael Tunnel, born on September 4, 1979, resides at 0584 Michael Tunnel in East Michaelside, OH. Known for his engaging personality, he often impresses friends and colleagues alike. During a recent trip, his organizational skills and attention to detail were evident, particularly when he navigated using his vehicle with the license plate TDV-1186. Michael can be reached at 001-260-747-7428x0710 for any inquiries or communications, showcasing his readiness to assist others. His VIN, 9M01NENYY2P95KDFZ, reflects his commitment to maintaining order in both personal and professional aspects of life.","[('TDV-1186', 'PLATE'), ('001-260-747-7428x0710', 'PHONE'), ('9M01NENYY2P95KDFZ', 'VIN')]","[('TDV-1186', 'PLATE'), ('001-260-747-7428x0710', 'PHONE'), ('9M01NENYY2P95KDFZ', 'VIN')]",1,1,1,1
"David Cruz, born on June 4, 1999, is a standout individual residing at 1426 Leslie Tunnel in Valerieberg, MI. Known for his reliability and strong work ethic, David has consistently impressed those around him. He has a knack for problem-solving, whether it’s fixing a vehicle, identified by its VIN of 36K4RBE60TWUK02JF, or assisting friends with their challenges. Additionally, David holds a California driver's license, number CA j44310000, which reflects his responsible nature. Anyone who knows David would agree that he brings a positive energy to any situation!","[('CA j44310000', 'DL'), ('36K4RBE60TWUK02JF', 'VIN'), ('David Cruz', 'NAME')]","[('David Cruz', 'NAME'), ('36K4RBE60TWUK02JF', 'VIN'), ('CA j44310000', 'DL')]",1,1,1,1
"Justin Mills was last seen on a sunny afternoon in downtown Portland. He had just finished a meeting with a friend at a local café and seemed in good spirits. Later that day, Justin’s phone number, 5849426744, was noted in a conversation about upcoming community events. His driver's license, OR G94990192, indicates he is a resident of Oregon. His IP address, 24.16.72.178, suggests he was active online shortly after their meeting, checking for details about local concerts. Friends describe him as friendly and sociable, often engaging with the community. Justin's absence has raised concerns among his close circle.","[('24.16.72.178', 'IP'), ('OR G94990192', 'DL'), ('5849426744', 'PHONE'), ('Justin Mills', 'NAME')]","[('Justin Mills', 'NAME'), ('5849426744', 'PHONE'), ('OR G94990192', 'DL'), ('24.16.72.178', 'IP')]",1,1,1,1
"Patrick Wood is a spirited and adventurous individual who brings a lively energy to any group. Known for his infectious laughter and open-minded approach, Patrick is always ready to explore new places and ideas. During a recent trip, he showcased his knack for making friends with locals, often engaging in meaningful conversations. Patrick's enthusiasm for different cultures and cuisines was evident as he tried everything from street food to traditional dishes. His friendly demeanor made everyone feel welcome, and he had a way of turning ordinary moments into memorable experiences. Patrick Wood's unique blend of curiosity and warmth truly enriches any journey!","[('Patrick Wood', 'NAME')]","[('Patrick Wood', 'NAME')]",1,1,1,1
"Meet Alex Thompson, a friendly and approachable individual who always seems to light up a room with his infectious energy. Known for his strong work ethic, Alex consistently goes above and beyond to help others, whether at work or in his community. He values honesty and loyalty, making him a trusted friend to many. For those looking to connect with Alex, his phone number is 513-697-2460. He is also passionate about personal finance and is keen on improving his credit, currently holding the number 4259178702338785. With a unique background captured in his bio BD84221, Alex is a person worth getting to know!","[('BD84221', 'BIO'), ('513-697-2460', 'PHONE'), ('4259178702338785', 'CREDIT')]","[('513-697-2460', 'PHONE'), ('4259178702338785', 'CREDIT'), ('BD84221', 'BIO')]",1,1,1,1
"Jonathan Brooks, born on June 29, 1959, is a remarkable individual who has made a positive impact in his community. His dedication and commitment are evident in everything he does, from his professional endeavors to his volunteer work. He values integrity and responsibility, as shown by his careful management of personal matters, like his driving license from Virginia and a valid passport. Jonathan is also tech-savvy, often navigating the digital world with ease, reflecting his adaptability in an ever-changing environment. With such a strong character, it's no surprise he is respected by many around him!","[('Jonathan Brooks', 'NAME')]","[('Jonathan Brooks', 'NAME')]",1,1,1,1
