Sentence,Ground Truth Entities,Model Predicted Entities,Precision,Recall,F1 Score,IoU
"During the recent trip, everyone got to know Samuel Thompson a bit better, and he really made an impression. With a knack for organizing adventures, Samuel was the one who handled all the logistics, making sure that everything went smoothly. His attention to detail was evident, from booking the perfect accommodations to navigating through passport control without a hitch. Plus, he even managed to keep track of the group’s expenses, ensuring that everyone contributed fairly. With his upbeat personality and friendly demeanor, Samuel really brought the group together and made the whole experience unforgettable!",[],[],0,0,0,0
"This background check report details relevant information about the individual born on January 27, 1981. With a unique identifier of BD25364, the individual has a Social Security Number of 530-66-5904. For inquiries or further communication, the contact number (442) 289-9470, extension 097, can be utilized. All provided information is essential for verification purposes and maintaining accurate records.","[('BD25364', 'BIO'), ('530-66-5904', 'SSN')]","[('BD25364', 'BIO'), ('530-66-5904', 'SSN')]",1,1,1,1
"John Smith, born on August 25, 1959, is a seasoned individual with a wealth of life experiences. Known for his friendly demeanor, he can often be reached at his phone number, +1-483-481-6157x48817, which he uses to stay connected with friends and family. He drives a car with the license plate MYH-8325, often seen cruising around town. John's Medicare record number is MR53647, reflecting his proactive approach to health. Despite a credit score that might raise eyebrows, he manages his finances with a mix of caution and strategy. Overall, John embodies a relatable, down-to-earth character in his community.","[('MR53647', 'MRN'), ('+1-483-481-6157x48817', 'PHONE'), ('MYH-8325', 'PLATE')]","[('+1-483-481-6157x48817', 'PHONE'), ('MYH-8325', 'PLATE'), ('MR53647', 'MRN')]",1,1,1,1
"This document pertains to Andre Schultz, who holds the Medical Record Number (MRN) MR89274. For any inquiries or further information, he can be reached at phone number 001-202-208-0522. Andre Schultz is identified by passport number 856580482 and resides at 817 Joseph Canyon, New John, IA 97650. This overview serves to compile essential identification and contact details for administrative purposes.","[('MR89274', 'MRN'), ('001-202-208-0522', 'PHONE'), ('856580482', 'PASSPORT'), ('817 Joseph Canyon, New John, IA 97650', 'ADDRESS'), ('Andre Schultz', 'NAME')]","[('Andre Schultz', 'NAME'), ('MR89274', 'MRN'), ('001-202-208-0522', 'PHONE'), ('856580482', 'PASSPORT'), ('817 Joseph Canyon, New John, IA 97650', 'ADDRESS')]",1,1,1,1
"In a bustling coffee shop, a man named Andrew Miller sat at a corner table, his laptop open and a steaming cup of coffee beside him. He was deeply engrossed in a project, occasionally glancing at the documents laid out in front of him. Among them was his passport, number 523799315, which he always kept handy for upcoming travels. His mind wandered briefly to his social security number, 894-97-4283, a number that seemed to follow him through every bureaucratic process. As he continued typing, Andrew noted the credit card number 4754847623700352 on a sticky note, reminding him to manage his finances. With a slight grin, he recalled his medical record number, MR84399, from a recent visit. It was just another day in the life of Andrew Miller!","[('MR84399', 'MRN'), ('894-97-4283', 'SSN'), ('4754847623700352', 'CREDIT'), ('523799315', 'PASSPORT')]","[('523799315', 'PASSPORT'), ('894-97-4283', 'SSN'), ('4754847623700352', 'CREDIT'), ('MR84399', 'MRN')]",1,1,1,1
"James Anderson, born on March 6, 1953, has been a valuable member of the organization since joining under employee number E85044. With extensive experience and a strong commitment to his role, James has contributed significantly to the team's success. He can be contacted at 001-987-213-8888. His unique biography identifier is BD09160, reflecting his professional journey within the institution. James's dedication to excellence and collaboration makes him an asset to the team.","[('E85044', 'EMP'), ('BD09160', 'BIO'), ('001-987-213-8888', 'PHONE')]","[('E85044', 'EMP'), ('001-987-213-8888', 'PHONE'), ('BD09160', 'BIO')]",1,1,1,1
"Matthew Ortiz is a professional with a background that includes a valid Massachusetts driver's license (MA u19838069) and a medical record number (MR28423). He can be reached at his phone number, (972) 200-8861 x3199. Known for his dedication and work ethic, Matthew contributes positively to his team and has established a reputation for reliability and commitment in his role. His ability to communicate effectively makes him a valuable asset in any collaborative environment.","[('Matthew Ortiz', 'NAME'), ('MA u19838069', 'DL'), ('MR28423', 'MRN')]","[('Matthew Ortiz', 'NAME'), ('MA u19838069', 'DL'), ('MR28423', 'MRN')]",1,1,1,1
"This character reference pertains to the individual associated with the Social Security Number 225-17-8066, who holds Passport Number 461329053. The individual is also linked to the vehicle identified by License Plate ZND-6030 and VIN DVRNV07T36L0GYPK7. The information provided is intended for verification purposes and reflects the individual’s lawful standing within the community. All details have been documented accurately to ensure proper identification and assessment.","[('461329053', 'PASSPORT'), ('DVRNV07T36L0GYPK7', 'VIN'), ('225-17-8066', 'SSN'), ('ZND-6030', 'PLATE')]","[('225-17-8066', 'SSN'), ('461329053', 'PASSPORT'), ('ZND-6030', 'PLATE'), ('DVRNV07T36L0GYPK7', 'VIN')]",1,1,1,1
"Jordan Thompson is a tech-savvy individual who enjoys staying connected with friends and family. Known for their vibrant personality, they often share fun updates online. Recently, Jordan has been focused on improving their digital security, regularly checking their IP address, which is 179.247.12.154. They also carry a valid driver's license, AR B74333927, and are proud of their unique MRN, MR25069. If you ever need to reach out, Jordan’s phone number is (278)271-5784, making them just a call away!","[('MR25069', 'MRN'), ('179.247.12.154', 'IP'), ('AR B74333927', 'DL'), ('(278)271-5784', 'PHONE')]","[('179.247.12.154', 'IP'), ('AR B74333927', 'DL'), ('MR25069', 'MRN'), ('(278)271-5784', 'PHONE')]",1,1,1,1
"At a recent gathering, everyone was captivated by the tales of Debbie Foster, a lively resident of East Brenda. Living at 3889 Vanessa Hill Apt. 101, she brings a spark to every conversation. With a knack for problem-solving, Debbie is known for her clever ideas and quick thinking, often sharing stories of her adventures. If anyone needs to reach her, they can easily call her at 3969035892. And let’s not forget her impressive credit score, a real testament to her financial savvy! Debbie's energy is infectious, making her the life of the party!","[('Debbie Foster', 'NAME'), ('3969035892', 'PHONE')]","[('Debbie Foster', 'NAME'), ('3969035892', 'PHONE')]",1,1,1,1
"Have you heard about Deanna Johnson? Apparently, she was born on October 20, 1981, and her passport number is 640301499. I heard she drives a car with the plate JEC-9786, which is quite memorable! Some folks were chatting about her work as well; they mentioned her employee number is E27053. It seems like Deanna keeps a pretty low profile, but her details are quite intriguing!","[('640301499', 'PASSPORT'), ('E27053', 'EMP'), ('Deanna Johnson', 'NAME'), ('JEC-9786', 'PLATE')]","[('640301499', 'PASSPORT'), ('JEC-9786', 'PLATE'), ('E27053', 'EMP')]",1,0.75,0.86,0.75
"During the recent trip, it became clear that Alex Thompson has a knack for bringing people together. With a friendly smile and a natural charisma, Alex effortlessly navigated the group dynamic. Known for their adventurous spirit, they were always the first to suggest exploring new places, like the hidden gems of the city. Fun fact: Alex is also quite the foodie, often sharing recommendations for local eats. With their keen organizational skills, they kept everything running smoothly, ensuring everyone was accounted for. It's no surprise that colleagues see Alex as a valuable team member, identified in the system as EMP: E10144. Exciting adventures await with Alex around!","[('E10144', 'EMP')]","[('E10144', 'EMP')]",1,1,1,1
"BD84285 is a dedicated professional based at 01461 Mckenzie Lights, Douglasland, SD 20877. With a robust background in their field, they have consistently demonstrated commitment to excellence and integrity. BD84285 holds a valid passport, number 992746013, which reflects their readiness for potential international engagements. Additionally, their vehicle identification number, R7Y91924WBPG2HJWU, underscores their attention to detail and compliance with regulatory standards. BD84285's qualifications and experience make them a valuable asset to any organization.","[('01461 Mckenzie Lights, Douglasland, SD 20877', 'ADDRESS'), ('992746013', 'PASSPORT'), ('BD84285', 'BIO'), ('R7Y91924WBPG2HJWU', 'VIN')]","[('BD84285', 'BIO'), ('01461 Mckenzie Lights, Douglasland, SD 20877', 'ADDRESS'), ('992746013', 'PASSPORT'), ('R7Y91924WBPG2HJWU', 'VIN')]",1,1,1,1
"Brian Curry is a dedicated individual who enjoys connecting with friends and family. He can often be reached at his phone number, 332-822-4484, where he shares updates about his latest adventures. With a unique background, Brian has an MRN of MR77468 and holds the bio ID BD01855, showcasing his distinct identity. Known for his resilience, he navigates life's challenges with determination. Whether he’s exploring new hobbies or spending time with loved ones, Brian brings a positive energy to everything he does!","[('BD01855', 'BIO'), ('MR77468', 'MRN'), ('Brian Curry', 'NAME')]","[('Brian Curry', 'NAME'), ('MR77468', 'MRN'), ('BD01855', 'BIO')]",1,1,1,1
"Phillip Harris, a dedicated automotive technician, was known for his keen attention to detail and problem-solving skills. One afternoon, he received a call on his phone, 985-684-8877x3337, from a customer in need of urgent assistance with a stubborn vehicle. The VIN, 2553UANAJ1L3Y6Y3L, led him to an unusual issue that had puzzled others. After diving into the car's complex systems, Phillip expertly diagnosed the problem, earning praise for his expertise. His passion for cars, combined with a business demeanor reflected in his EMP number, E91652, made him a trusted figure in the local community. Phillip's dedication was evident in every job he undertook!","[('Phillip Harris', 'NAME'), ('985-684-8877x3337', 'PHONE'), ('E91652', 'EMP'), ('2553UANAJ1L3Y6Y3L', 'VIN')]","[('Phillip Harris', 'NAME'), ('985-684-8877x3337', 'PHONE'), ('2553UANAJ1L3Y6Y3L', 'VIN'), ('E91652', 'EMP')]",1,1,1,1
"This profile pertains to an individual born on April 12, 1948, who currently holds the employee identification number E36338. The individual is associated with the vehicle identified by the license plate BAI-2466. For further communication, the contact number is 001-920-550-2486, extension 010. This summary provides essential details for formal application purposes.","[('E36338', 'EMP'), ('BAI-2466', 'PLATE')]","[('E36338', 'EMP'), ('BAI-2466', 'PLATE')]",1,1,1,1
"Gail Vaughn is a dedicated professional based at Unit 9697 Box 4101, DPO AE 25748. With a strong background in her field, she brings valuable expertise to her role. Gail is known for her commitment to excellence and her collaborative spirit, making her a respected member of the team. Her attention to detail and innovative approach contribute significantly to project success. Gail is also recognized for her effective communication skills and ability to adapt in dynamic environments. She continues to inspire those around her with her passion for her work!","[('Unit 9697 Box 4101, DPO AE 25748', 'ADDRESS'), ('Gail Vaughn', 'NAME')]","[('Gail Vaughn', 'NAME'), ('Unit 9697 Box 4101, DPO AE 25748', 'ADDRESS')]",1,1,1,1
"This background check report details the personal information of an individual born on May 30, 1970. The subject possesses a driver's license issued in Alaska, identified by the number v46318864. A review of vehicle registration indicates a license plate numbered NSF-1818. The individual's credit information reveals a credit card number starting with 4038610. Additionally, the report includes an IP address traceable to 68.41.131.186 and a Social Security Number of 851-25-1664. Further investigations may be warranted to gain a comprehensive understanding of the individual's background and financial history.","[('NSF-1818', 'PLATE'), ('68.41.131.186', 'IP'), ('851-25-1664', 'SSN')]","[('NSF-1818', 'PLATE'), ('68.41.131.186', 'PHONE'), ('851-25-1664', 'SSN')]",0.67,0.67,0.67,0.5
"Sorry, but I can't assist with that.",[],[],0,0,0,0
"Larry Franklin is a dedicated professional based in Aaronfurt, South Carolina. With a keen eye for detail and a strong work ethic, he consistently delivers high-quality results in his field. Larry can be reached at +1-237-669-6455x996 for any inquiries. He has a valid driver's license (DL: MN V01619569), which enables him to travel for work-related tasks. Residing at 86585 Christina Branch, Larry values collaboration and is always willing to assist his colleagues. His commitment to excellence makes him a respected member of the team!","[('MN V01619569', 'DL'), ('+1-237-669-6455x996', 'PHONE'), ('Larry Franklin', 'NAME')]","[('Larry Franklin', 'NAME'), ('+1-237-669-6455x996', 'PHONE'), ('MN V01619569', 'DL')]",1,1,1,1
"At a recent gathering, someone mentioned their old car, a classic beauty with the plate number UWV-1336. Everyone leaned in, intrigued by its history. The owner, who was born on February 13, 1969, proudly shared how the car, with its VIN BTFHR6F6JU52XWDAF, had been a family heirloom, passed down through generations. It had a charming IP address, 191.66.214.246, which everyone joked was just as old as the car itself! The laughter and stories flowed as the owner reminisced about road trips and summer adventures, making everyone wish they had a piece of vintage nostalgia like that. What a ride!","[('BTFHR6F6JU52XWDAF', 'VIN'), ('191.66.214.246', 'IP'), ('UWV-1336', 'PLATE')]","[('UWV-1336', 'PLATE'), ('BTFHR6F6JU52XWDAF', 'VIN'), ('191.66.214.246', 'IP')]",1,1,1,1
"Did you hear about that new resident at 413 Stephanie Gateway in Ashleyshire? Word is, they drive a sharp-looking car with the plate KBM-7827 and have a mysterious EMP number, E68992. It’s funny how these things get around! And apparently, their medical record number is MR34537, which has some folks buzzing about what they might be hiding. You know how nosy people can get! It makes you wonder what kind of secrets they’re keeping over there. Sounds like they’re just trying to blend in, but that address is definitely raising some eyebrows!","[('E68992', 'EMP'), ('MR34537', 'MRN'), ('KBM-7827', 'PLATE')]","[('KBM-7827', 'PLATE'), ('E68992', 'EMP'), ('MR34537', 'MRN')]",1,1,1,1
"At the office, Alex Johnson is known for always being on top of things. Just the other day, they received a call on their phone, 475.202.7690, while juggling multiple projects. Alex has a knack for multitasking that never fails to impress the team. During a lunch break, they shared a funny story about their recent passport renewal, where their passport number, 154876097, seemed to get mixed up with a friend’s. That’s classic Alex, making light of any situation! They also have a unique employee number, E72687, which everyone jokes about whenever they need a quick reference. Alex really makes the workplace a fun environment!","[('E72687', 'EMP'), ('154876097', 'PASSPORT'), ('475.202.7690', 'PHONE')]","[('475.202.7690', 'PHONE'), ('154876097', 'PASSPORT'), ('E72687', 'EMP')]",1,1,1,1
"Casey Walker resides at 410 Morris Shoals, Suite 045 in Lake Davidville, MP 94844. Known for a positive attitude and strong work ethic, Casey has made a notable impact in their community. With a medical record number of MR64579, Casey prioritizes their health and well-being. They also manage their financial responsibilities diligently, as evidenced by the credit card number ending in 5263. In their free time, Casey enjoys engaging in local volunteer work and outdoor activities, showcasing a commitment to both personal growth and community service. This blend of qualities makes Casey a well-rounded individual!","[('Casey Walker', 'NAME'), ('MR64579', 'MRN')]","[('Casey Walker', 'NAME'), ('MR64579', 'MRN')]",1,1,1,1
"Josephine Turner, born on March 23, 1938, is a vibrant and spirited individual who has seen the world change in remarkable ways. With a keen interest in history and storytelling, she often captivates her friends with tales from her travels. Josephine is known for her kindness and generosity, always ready to lend a helping hand. She can be reached at her phone number, 001-995-422-6387x096, and her dependable nature is reflected in her clean driving record, under her driver's license number LA V57221430. Additionally, her adventurous spirit is showcased by her passport, 462210992, which is filled with stamps from her many journeys. Josephine truly embodies the essence of a lifelong learner and adventurer!","[('LA V57221430', 'DL'), ('001-995-422-6387x096', 'PHONE'), ('462210992', 'PASSPORT')]","[('001-995-422-6387x096', 'PHONE'), ('LA V57221430', 'DL'), ('462210992', 'PASSPORT')]",1,1,1,1
"Everyone knows BD37884 at the office for his upbeat personality and incredible work ethic. Born on July 14, 1977, he has been with the company since his employee number E47444 was issued. BD37884 always brings a smile to the team, whether it's a casual Friday or a high-pressure deadline. He’s also the go-to guy for tech issues, often helping others with their devices. If you ever need to reach him, you can dial 232-966-9567x012. Plus, with his MRN MR03603, he's got all the paperwork sorted out! People appreciate how he's always willing to lend a hand or share a laugh.","[('E47444', 'EMP'), ('BD37884', 'BIO'), ('232-966-9567x012', 'PHONE'), ('MR03603', 'MRN')]","[('BD37884', 'BIO'), ('E47444', 'EMP'), ('232-966-9567x012', 'PHONE'), ('MR03603', 'MRN')]",1,1,1,1
"The individual in question is recognized for their professional contributions within the organization. They are employed under the identifier EMP: E36494, demonstrating a commitment to their role. Notably, their credit record, associated with the number CREDIT: 4391462939023496, reflects responsible financial management. The individual operates from the IP address 212.24.173.37 and resides at the address 41088 Arroyo Route, Brownbury, MT 15525. Additionally, they hold a valid driver's license, DL: MS f96624528, which underscores their compliance with regulatory standards. The VIN for their vehicle is FEUVZKEDATVFL2UGC, indicating ownership of a registered automobile.","[('E36494', 'EMP'), ('FEUVZKEDATVFL2UGC', 'VIN'), ('MS f96624528', 'DL'), ('4391462939023496', 'CREDIT'), ('212.24.173.37', 'IP'), ('41088 Arroyo Route, Brownbury, MT 15525', 'ADDRESS')]","[('E36494', 'EMP'), ('4391462939023496', 'CREDIT'), ('212.24.173.37', 'IP'), ('41088 Arroyo Route, Brownbury, MT 15525', 'ADDRESS'), ('MS f96624528', 'DL'), ('FEUVZKEDATVFL2UGC', 'VIN')]",1,1,1,1
"At a recent gathering, the conversation turned to interesting career paths, and one could not help but mention HBN-5182, known for their intriguing work background. With a knack for problem-solving, they have made a name for themselves in their field, working under the employee number E66165. Residing at Unit 5806 Box 4216, DPO AP 22377, HBN-5182 shared their adventures while casually noting their driver's license KS X19755581 as a fun tidbit. It's always fascinating to hear the stories behind the names and numbers!","[('HBN-5182', 'PLATE'), ('KS X19755581', 'DL'), ('Unit 5806 Box 4216, DPO AP 22377', 'ADDRESS'), ('E66165', 'EMP')]","[('HBN-5182', 'PLATE'), ('E66165', 'EMP'), ('Unit 5806 Box 4216, DPO AP 22377', 'ADDRESS'), ('KS X19755581', 'DL')]",1,1,1,1
"BD66394 is a resident of Kimberlyberg, Hawaii, residing at 070 Robert Overpass Suite 524. Known for a friendly demeanor, BD66394 enjoys engaging with the local community and often participates in neighborhood events. With an SSN of 756-01-8818, this individual has a solid reputation for reliability and trustworthiness. BD66394 holds a passport numbered 780094379, which has facilitated various travels for personal and professional development. Overall, BD66394 exemplifies the values of community involvement and responsible citizenship!","[('BD66394', 'BIO'), ('756-01-8818', 'SSN'), ('780094379', 'PASSPORT')]","[('BD66394', 'BIO'), ('070 Robert Overpass Suite 524. Known for a friendly demeanor, BD66394 enjoys engaging with the local community and often participates in neighborhood events. With an SSN of 756-01-8818', 'ADDRESS'), ('780094379', 'PASSPORT')]",0.67,0.67,0.67,0.5
"In a quiet corner of the coffee shop, James Anderson sat absorbed in his laptop, seemingly oblivious to the world around him. The aroma of freshly brewed coffee lingered in the air, but his focus was on his work, as he occasionally glanced at his phone, which flashed with notifications. His passport, number 636166110, rested nearby on the table, an indication of his recent travels. Outside, a sleek vehicle with the VIN RMJSCA44BGD6XN1DZ was parked, the sun glinting off its polished surface. James, with his SSN 519-98-4523 securely stored in his digital files, was a man on a mission, with plans that went beyond the caffeine buzz of the moment.","[('RMJSCA44BGD6XN1DZ', 'VIN'), ('636166110', 'PASSPORT'), ('519-98-4523', 'SSN')]","[('636166110', 'PASSPORT'), ('RMJSCA44BGD6XN1DZ', 'VIN'), ('519-98-4523', 'SSN')]",1,1,1,1
"After the trip, everyone couldn’t stop talking about Jordan Thompson, EMP: E91234. He was such a great travel buddy, always up for an adventure! With his knack for storytelling, he kept the group entertained. Jordan’s background is impressive, highlighted by his BIO: BD37364, which showcases his dedication to excellence. Living at USNS Burke, FPO AP 87332, he brings a unique perspective to our discussions. We even laughed about his old car with the plate HIV-8786, and he shared stories about its quirky VIN: ULMGSX8DZ28T2TM0E. Plus, we joked about his IP: 198.20.94.57 after he tried to connect to Wi-Fi everywhere! What a fun experience!","[('BD37364', 'BIO'), ('ULMGSX8DZ28T2TM0E', 'VIN'), ('USNS Burke, FPO AP 87332', 'ADDRESS'), ('HIV-8786', 'PLATE'), ('198.20.94.57', 'IP'), ('E91234', 'EMP')]","[('E91234', 'EMP'), ('BD37364', 'BIO'), ('HIV-8786', 'PLATE'), ('ULMGSX8DZ28T2TM0E.', 'VIN'), ('198.20.94.57', 'IP')]",0.8,0.67,0.73,0.57
"Did you hear about Lisa Montgomery? Apparently, she was born on December 25, 1984, which totally explains her jolly demeanor. The other day, she was chatting about how her phone number, 331-560-3009, gets tons of spam calls, but she just laughs it off. Rumor has it that her medical record number is MR31212, and she even has a unique bio, BD61452. It’s wild how much personal info gets shared these days, like her SSN, 489-76-2872, which is just a number in the air for some! But honestly, who wouldn’t want to be friends with someone as cheerful as her?","[('BD61452', 'BIO'), ('489-76-2872', 'SSN'), ('331-560-3009', 'PHONE'), ('MR31212', 'MRN')]","[('331-560-3009', 'PHONE'), ('MR31212', 'MRN'), ('BD61452', 'BIO'), ('489-76-2872', 'SSN')]",1,1,1,1
"At a recent gathering, attendees were captivated by the stories of a remarkable individual born on October 5, 1935. With a unique passport number, 127539210, this person has certainly seen the world evolve over the decades. Their residence at 820 Lopez Islands Apt. 469 in Lake Markmouth, AR, is a cozy spot where many friends have shared fond memories. Interestingly, they hold the medical record number MR57692, reminding everyone of their rich experiences. Though the specifics of their social security number, 803-12-3384, were not discussed, it served as a reminder of their long journey through life, marked by numerous adventures and anecdotes.","[('MR57692', 'MRN'), ('803-12-3384', 'SSN'), ('127539210', 'PASSPORT')]","[('127539210', 'PASSPORT'), ('MR57692', 'MRN'), ('803-12-3384', 'SSN')]",1,1,1,1
"Victor White is a well-respected member of the community, known for his involvement in local initiatives and support for his neighbors. His driver's license number, HI g38743924, reflects his commitment to safe driving in Hawaii. With a keen interest in community safety, Victor has been proactive in advocating for programs that benefit all residents. Additionally, his social security number, 714-01-6812, is linked to his active engagement in various social programs. Driving his reliable vehicle, VIN MSMNVW53SV054H9BE, Victor often participates in local events. With an IP address of 175.22.239.127, he stays connected and informed about community matters, further showcasing his dedication.","[('Victor White', 'NAME'), ('MSMNVW53SV054H9BE', 'VIN'), ('HI g38743924', 'DL'), ('714-01-6812', 'SSN'), ('175.22.239.127', 'IP')]","[('Victor White', 'NAME'), ('HI g38743924', 'DL'), ('714-01-6812', 'SSN'), ('MSMNVW53SV054H9BE', 'VIN'), ('175.22.239.127', 'IP')]",1,1,1,1
