Sentence,Ground Truth Entities,Model Predicted Entities,Precision,Recall,F1 Score,IoU
"John Smith is associated with the IP address 15.120.174.165 and holds the employee number E18762. His current residence is at 5898 Joshua Via, Codymouth, NJ 14833. John’s medical record number is MR00378, indicating a history of interactions with the healthcare system relevant to his employment. This information is vital for maintaining accurate records and ensuring compliance with organizational policies.","[('MR00378', 'MRN'), ('5898 Joshua Via, Codymouth, NJ 14833', 'ADDRESS'), ('E18762', 'EMP'), ('15.120.174.165', 'IP')]","[('15.120.174.165', 'IP'), ('E18762', 'EMP'), ('5898 Joshua Via, Codymouth, NJ 14833', 'ADDRESS'), ('MR00378', 'MRN')]",1,1,1,1
"At a gathering in West Autumnview, guests were delighted to learn about the intriguing background of a certain individual residing at 355 Dennis Union, Suite 658. This person, known for their distinctive employee number E41041, shared fascinating stories of travel adventures, especially after showing off their passport number 965649070. With a knack for connecting with others, they fielded questions about their experiences, all while cheerfully answering phone calls, including the notably easy-to-remember 2873493939. Their infectious enthusiasm left everyone wanting to hear more!","[('2873493939', 'PHONE'), ('965649070', 'PASSPORT'), ('E41041', 'EMP')]","[('E41041', 'EMP'), ('965649070', 'PASSPORT'), ('2873493939', 'PHONE')]",1,1,1,1
"BD14797, born on May 20, 1982, is a dedicated individual who has demonstrated a strong commitment to their professional responsibilities. They hold a valid passport with the number 757986861 and possess a Nebraska driver's license, numbered w19831147. BD14797 can be reached at the phone number 713.814.1567 for any necessary communications. Additionally, their vehicle is registered under the plate RMO-9262. This profile reflects BD14797's reliable nature and readiness to engage in professional endeavors.","[('713.814.1567', 'PHONE'), ('BD14797', 'BIO'), ('757986861', 'PASSPORT'), ('RMO-9262', 'PLATE')]","[('BD14797', 'BIO'), ('757986861', 'PASSPORT'), ('713.814.1567', 'PHONE'), ('RMO-9262', 'PLATE')]",1,1,1,1
"Diane Berry, born on June 26, 1986, is known for her vibrant personality and love for adventure. Often seen cruising around town in her car with the license plate TSR-7542, she has a knack for making friends wherever she goes. With a unique vehicle identification number (VIN) CN1MV28GBT9S947GT, Diane is quite the character, and her medical record number, MR04653, adds an interesting touch to her background. Always ready for new experiences, Diane's zest for life is contagious, making her a beloved figure in her community!","[('CN1MV28GBT9S947GT', 'VIN'), ('MR04653', 'MRN'), ('TSR-7542', 'PLATE'), ('Diane Berry', 'NAME')]","[('Diane Berry', 'NAME'), ('TSR-7542', 'PLATE'), ('CN1MV28GBT9S947GT', 'VIN'), ('MR04653', 'MRN')]",1,1,1,1
"This character reference pertains to the individual with the following identifiers: VIN ZD9TAB1VBZ20FF4YK, Passport number 687200901, and BIO BD49313. Born on October 3, 1965, this individual has demonstrated a consistent commitment to their personal and professional responsibilities. Their background reflects a strong adherence to ethical standards and community values. Throughout their life, they have established themselves as a reliable member of society, contributing positively to their surroundings and embodying the principles of integrity and respect. This overview serves to highlight the commendable qualities and character of this individual.","[('ZD9TAB1VBZ20FF4YK', 'VIN'), ('687200901', 'PASSPORT'), ('BD49313', 'BIO')]","[('ZD9TAB1VBZ20FF4YK', 'VIN'), ('687200901', 'PASSPORT'), ('BD49313', 'BIO')]",1,1,1,1
"Richard King is a professional with a diverse background, recognized by various identifiers including a VIN of AFEHH129WBWCYGXUY and a BIO number BD41418. His unique MRN is MR97220, and his social security number is 079-31-5334. Additionally, Richard holds a passport with the number 897911588, highlighting his international mobility and readiness for travel. With a commitment to excellence, Richard King continues to make significant contributions in his field.","[('897911588', 'PASSPORT'), ('Richard King', 'NAME'), ('BD41418', 'BIO'), ('AFEHH129WBWCYGXUY', 'VIN'), ('MR97220', 'MRN'), ('079-31-5334', 'SSN')]","[('Richard King', 'NAME'), ('AFEHH129WBWCYGXUY', 'VIN'), ('BD41418', 'BIO'), ('MR97220', 'MRN'), ('079-31-5334', 'SSN'), ('897911588', 'PASSPORT')]",1,1,1,1
"During a typical afternoon, John Doe was seen enjoying a cup of coffee at his favorite café in downtown Milwaukee. Known for his friendly demeanor, he struck up a conversation with a few regulars, sharing light-hearted jokes and stories. As he reached for his phone, a quick glance revealed the number 826-458-9275 flashing on the screen. His wallet, tucked under the table, contained his Wisconsin driver’s license, DL Y54797222, and his BIO BD57658 card. Later, he even shared a tidbit about his recent credit card purchase, revealing the last four digits of his card, which was 7498. John certainly brightened the day for those around him!","[('826-458-9275', 'PHONE'), ('BD57658', 'BIO')]","[('826-458-9275', 'PHONE'), ('BD57658', 'BIO')]",1,1,1,1
"During the recent work trip, the team had a chance to bond with BD17960, who was a standout presence. BD17960 showed exceptional attention to detail, especially when reviewing the project materials, and always kept the group focused on their goals. One afternoon, while waiting for their flight, BD17960 shared a fascinating story about a past project, showcasing their creative problem-solving skills. Not only did BD17960 handle their tasks with ease, but their enthusiasm also lifted everyone's spirits. It was a memorable experience, and the team is fortunate to have BD17960 as a colleague!","[('BD17960', 'BIO')]","[('BD17960', 'BIO')]",1,1,1,1
"Jordan Smith, born on April 7, 1984, holds a valid Ohio driver's license numbered s17647992. He is known to have the Social Security Number 879-86-1204, and can be reached at the phone number 960.831.6272, extension 170. Additionally, his vehicle is registered under the license plate VDV-9847. This information may be useful for identification purposes and to verify his records.","[('VDV-9847', 'PLATE'), ('879-86-1204', 'SSN')]","[('879-86-1204', 'SSN'), ('VDV-9847', 'PLATE')]",1,1,1,1
"The individual associated with BIO BD48914 has a date of birth of October 27, 2004. Residing at 764 Miller Run, North Charlesbury, AZ 45443, this person holds a passport number 358830966 and an employment identifier of E65665. The vehicle identification number (VIN) for their registered vehicle is 8HP8DNY69HM5HHSB7. This summary provides a concise overview of the key identifiers relevant to the case.","[('764 Miller Run, North Charlesbury, AZ 45443', 'ADDRESS'), ('358830966', 'PASSPORT'), ('8HP8DNY69HM5HHSB7', 'VIN'), ('BD48914', 'BIO'), ('E65665', 'EMP')]","[('BD48914', 'BIO'), ('764 Miller Run, North Charlesbury, AZ 45443', 'ADDRESS'), ('358830966', 'PASSPORT'), ('E65665', 'EMP'), ('8HP8DNY69HM5HHSB7', 'VIN')]",1,1,1,1
"I'm sorry, but I can't assist with that.",[],[],0,0,0,0
"The individual holds a valid driver's license, numbered OK o61339140, and can be reached at the phone number 410.324.1906. They reside at 39499 Martin Village Apt. 611, Port Victoria, TN 68241. Their medical record number is MR51179, and their Social Security number is 637-30-4393. This information is crucial for maintaining accurate records and ensuring compliance with company policies regarding personal data management.","[('410.324.1906', 'PHONE'), ('39499 Martin Village Apt. 611, Port Victoria, TN 68241', 'ADDRESS'), ('OK o61339140', 'DL'), ('MR51179', 'MRN'), ('637-30-4393', 'SSN')]","[('OK o61339140', 'DL'), ('410.324.1906', 'PHONE'), ('39499 Martin Village Apt. 611, Port Victoria, TN 68241', 'ADDRESS'), ('MR51179', 'MRN'), ('637-30-4393', 'SSN')]",1,1,1,1
"Justin Zavala is a professional with a diverse background in various fields. His credit score is associated with the number 4227324275924531, indicating a reliable financial history. Justin's IP address is recorded as 220.47.128.242, reflecting his online presence. He is employed under the identifier E51729, showcasing his current professional engagement. Additionally, his Social Security Number is 013-15-9491, which is relevant for identification purposes. Overall, Justin Zavala possesses a solid foundation for professional endeavors and responsibilities.","[('220.47.128.242', 'IP'), ('4227324275924531', 'CREDIT'), ('Justin Zavala', 'NAME'), ('013-15-9491', 'SSN'), ('E51729', 'EMP')]","[('Justin Zavala', 'NAME'), ('4227324275924531', 'CREDIT'), ('220.47.128.242', 'IP'), ('E51729', 'EMP'), ('013-15-9491', 'SSN')]",1,1,1,1
"So, there was this hilarious moment at the party when someone mentioned they just got a new ride. Turns out, the car was a shiny EMP: E08234 with the license plate LOQ-4231. Everyone started teasing him about his VIN, Y203MRKT2ERTXXLDT, but he shrugged it off like a champ. Then, out of nowhere, he pulled out his passport with number 652454023, claiming he was ready for a spontaneous trip! He joked about needing a new address since he lived at 621 Brenda Lane, Jamesshire, WV 38732, and he was clearly just itching to escape. What a character!","[('621 Brenda Lane, Jamesshire, WV 38732', 'ADDRESS'), ('Y203MRKT2ERTXXLDT', 'VIN'), ('652454023', 'PASSPORT'), ('LOQ-4231', 'PLATE'), ('E08234', 'EMP')]","[('E08234', 'EMP'), ('LOQ-4231', 'PLATE'), ('Y203MRKT2ERTXXLDT', 'VIN'), ('652454023', 'PASSPORT'), ('621 Brenda Lane, Jamesshire, WV 38732', 'ADDRESS')]",1,1,1,1
"Sorry, but I can't assist with that.",[],[],0,0,0,0
"Oliver Jennings is a 46-year-old resident of Lake Amandaville, living at 8412 Morgan Inlet. Known for his easygoing personality, he has built a reputation as a reliable friend and neighbor. With a birth date of June 26, 1977, Oliver was issued Washington driver's license WA a63668448, and his Social Security Number is 437-80-7403. He often volunteers at local events, demonstrating his commitment to community engagement. While details like VIN B02XR7HXXP6CK3P5E and BIO BD32912 may raise eyebrows, his approachable demeanor and consistent involvement in neighborhood activities make him a valued member of the Lake Amandaville community!","[('WA a63668448', 'DL'), ('B02XR7HXXP6CK3P5E', 'VIN'), ('BD32912', 'BIO'), ('437-80-7403', 'SSN')]","[('Oliver Jennings', 'NAME'), ('WA a63668448', 'DL'), ('437-80-7403', 'SSN'), ('B02XR7HXXP6CK3P5E', 'VIN'), ('BD32912', 'BIO')]",0.8,1,0.89,0.8
"Sierra Berry, identified by EMP E34265, is applying for a formal position requiring verification of her credentials. She holds a driver’s license with the ID T56805598, registered at the address 1582 Michael Brook, Port Caitlyn, MD 67351. Additionally, her biological identification is noted as BD85042. This information is essential for completing the application process and ensuring compliance with all relevant regulations.","[('ID T56805598', 'DL'), ('1582 Michael Brook, Port Caitlyn, MD 67351', 'ADDRESS'), ('BD85042', 'BIO'), ('E34265', 'EMP'), ('Sierra Berry', 'NAME')]","[('Sierra Berry', 'NAME'), ('E34265', 'EMP'), ('ID T56805598', 'DL'), ('1582 Michael Brook, Port Caitlyn, MD 67351', 'ADDRESS'), ('BD85042', 'BIO')]",1,1,1,1
"Patricia Rodriguez is an incredibly vibrant person known for her infectious energy and zest for life. During a recent trip, her friends marveled at her ability to connect with people from all walks of life. Patricia’s keen sense of adventure was evident as she fearlessly tried local dishes and explored hidden gems in every city they visited. With a knack for storytelling, she kept everyone entertained with her hilarious anecdotes. Aside from her adventurous spirit, Patricia is also reliable—she's the one you can count on to lend a helping hand whenever needed. She is definitely someone who leaves a lasting impression!","[('Patricia Rodriguez', 'NAME')]","[('Patricia Rodriguez', 'NAME')]",1,1,1,1
"Dylan Snyder, born on July 7, 1971, resides at 41265 David Mills in East Chloe, ID 16587. Known for his friendly demeanor, he often engages with neighbors and volunteers at local community events. Dylan has a distinctive silver sedan with the license plate TVF-3051, which he takes pride in maintaining. His vehicle is frequently seen around town, as he enjoys exploring the local parks and scenic routes. Professionally, Dylan is recognized for his commitment to his work and has established a reputation for reliability, evidenced by his employment record under EMP: E53603. Overall, he is a valued member of the East Chloe community!","[('E53603', 'EMP'), ('Dylan Snyder', 'NAME'), ('TVF-3051', 'PLATE')]","[('Dylan Snyder', 'NAME'), ('TVF-3051', 'PLATE'), ('E53603', 'EMP')]",1,1,1,1
"On a bright Tuesday morning, Alex Johnson arrived at the office ready to tackle the day's challenges. Known for his meticulous attention to detail, he made sure his workspace was organized before diving into a critical project. He often collaborated with the finance team, utilizing his analytical skills to provide insights on budget allocations. During a coffee break, he answered a call on his phone, (738) 234-0099x5585, discussing an important client update. With his professional demeanor and problem-solving abilities, Alex continues to impress colleagues. After work, he headed home in his car, license plate GTM-3979, reflecting on the successful day behind a computer with the IP address 137.71.46.225.","[('GTM-3979', 'PLATE'), ('137.71.46.225', 'IP')]","[('GTM-3979', 'PLATE'), ('137.71.46.225', 'IP')]",1,1,1,1
"At the bustling headquarters of a tech firm in North Roger, South Carolina, one could often find Emily Hartman at her desk in Suite 965. With her keen eye for detail and knack for problem-solving, she has become an invaluable member of the team, recognized by her employee ID E96781. When she’s not tackling the latest project, Emily can be seen zipping around the office parking lot in her reliable car, a sleek model with the plate number WDN-2159. Her dedication to her work is as steadfast as the vehicle she drives, registered under the VIN 1MTHKUSJL7HV14NSW, a testament to her meticulous nature. Emily's commitment truly shines in all she does!","[('WDN-2159', 'PLATE'), ('E96781', 'EMP'), ('1MTHKUSJL7HV14NSW', 'VIN')]","[('E96781', 'EMP'), ('WDN-2159', 'PLATE'), ('1MTHKUSJL7HV14NSW', 'VIN')]",1,1,1,1
"Ellen Miller has been the talk of the town lately, especially with her recent visit to 042 Brown Camp Suite 155 in Port Gregorymouth. Folks have noticed her distinctive vehicle, a sedan with the plate XRW-1413, parked outside often. If anyone needs to reach her, they say her phone number is (521) 895-2278x808. Interestingly, some are curious about her medical record number, MR48281, and her driver's license ID, L89180790, which seem to come up in casual conversations. It’s fascinating how small details like these can spark such interest!","[('XRW-1413', 'PLATE'), ('Ellen Miller', 'NAME'), ('MR48281', 'MRN')]","[('Ellen Miller', 'NAME'), ('XRW-1413', 'PLATE'), ('MR48281', 'MRN')]",1,1,1,1
"The individual associated with the license plate UUH-7869, identified by driver’s license number DC Y69765953, resides at 98911 Rodriguez Tunnel, West Kyle, GU 87608. Their internet protocol address is 12.31.111.3, and they possess a unique bio identifier of BD17882. This information highlights their established presence and identity within the community. Further insights into their professional background and contributions may provide valuable context for understanding their role in institutional collaborations and initiatives.","[('12.31.111.3', 'IP'), ('UUH-7869', 'PLATE'), ('98911 Rodriguez Tunnel, West Kyle, GU 87608', 'ADDRESS'), ('DC Y69765953', 'DL'), ('BD17882', 'BIO')]","[('UUH-7869', 'PLATE'), ('DC Y69765953', 'DL'), ('98911 Rodriguez Tunnel, West Kyle, GU 87608', 'ADDRESS'), ('12.31.111.3', 'IP'), ('BD17882', 'BIO')]",1,1,1,1
"Erica Jones is a vibrant individual known for her friendly demeanor and unwavering dedication at work. She has been making waves at her job, identified by her employee number E77713. On weekends, Erica loves exploring local parks and enjoying the Texas sun. Friends often reach out to her at +1-830-886-4557, knowing she’s always up for a spontaneous adventure. Whether she’s discussing her latest project or sharing a laugh over coffee, Erica brings a sense of warmth and positivity wherever she goes. She truly embodies the spirit of Texas!","[('+1-830-886-4557', 'PHONE'), ('Erica Jones', 'NAME'), ('E77713', 'EMP')]","[('Erica Jones', 'NAME'), ('E77713', 'EMP'), ('+1-830-886-4557', 'PHONE')]",1,1,1,1
"At a lively gathering last Saturday, Alexis Juarez shared a hilarious story about her last trip abroad. She excitedly recounted how her passport, number 782801651, almost got her into trouble at the airport when the officer mistook her for someone else. Everyone laughed as she mimicked the encounter. While chatting, someone asked about her job, and Alexis proudly mentioned her employee ID, E77817, reminding everyone that she’s quite the dedicated worker. Later in the evening, she revealed her go-to travel tip, which was to always double-check the IP address on her devices—174.212.228.168—before connecting to public Wi-Fi. What a night!","[('782801651', 'PASSPORT'), ('Alexis Juarez', 'NAME'), ('174.212.228.168', 'IP'), ('E77817', 'EMP')]","[('Alexis Juarez', 'NAME'), ('782801651', 'PASSPORT'), ('E77817', 'EMP')]",1,0.75,0.86,0.75
"Born on February 2, 1942, this individual has a wealth of experience to draw from, making them a valuable asset in any professional setting. They have demonstrated a strong commitment to their work, and their reliable nature is reflected in the way they maintain their credentials, including their driver's license and passport. Known for their thoughtful contributions and integrity, they are recognized not only for their professional skills but also for their dependable character. Their efficiency in managing personal affairs, such as their vehicle, speaks volumes about their organized approach. A true professional, they continue to inspire those around them!",[],[],0,0,0,0
"Patricia Green is quite the character in the neighborhood! Always ready with a warm smile and a story to share, she's the kind of person who makes you feel at home. Living at PSC 5540, Box 3428, APO AE 13204, she often invites neighbors over for her famous cookies. Patricia can be reached at 980-762-0174x97064, and believe me, she'll chat your ear off about her latest garden project or her travels. She's also got a knack for trivia, especially about her driver's license, NE q29113998, which she jokes about losing during her last adventure. Everyone loves Patricia—she truly brightens up the block!","[('980-762-0174x97064', 'PHONE'), ('PSC 5540, Box 3428, APO AE 13204', 'ADDRESS'), ('NE q29113998', 'DL'), ('Patricia Green', 'NAME')]","[('Patricia Green', 'NAME'), ('PSC 5540, Box 3428, APO AE 13204', 'ADDRESS'), ('980-762-0174x97064', 'PHONE'), ('NE q29113998', 'DL')]",1,1,1,1
"The individual resides at 5510 Harvey Viaduct Suite 027, Micheleland, OH 02207. Their vehicle is registered under the license plate RDR-8702. The medical record number associated with this person is MR15551. Born on March 5, 1955, they hold a passport with the number 502208705. The individual's social security number is 571-94-6447. This profile encompasses essential identification information for internal reference.","[('5510 Harvey Viaduct Suite 027, Micheleland, OH 02207', 'ADDRESS'), ('571-94-6447', 'SSN'), ('RDR-8702', 'PLATE'), ('MR15551', 'MRN'), ('502208705', 'PASSPORT')]","[('5510 Harvey Viaduct Suite 027, Micheleland, OH 02207', 'ADDRESS'), ('RDR-8702', 'PLATE'), ('MR15551', 'MRN'), ('502208705', 'PASSPORT'), ('571-94-6447', 'SSN')]",1,1,1,1
"At the party, everyone was chatting about their latest adventures, and then someone brought up the birthday boy, who was born on February 26, 2007. It turns out he has an impressive knack for remembering random numbers—like the VIN of his favorite car or his own MRN, which is MR29956. As the night went on, they jokingly tried to guess his credit card number, 4836409447809950, which he quickly shot down, laughing about keeping that info private. They even joked about calling him up at 221-609-9328x151 for a midnight snack run! What a fun night to celebrate an awesome kid!","[('MR29956', 'MRN'), ('4836409447809950', 'CREDIT'), ('221-609-9328x151', 'PHONE')]","[('MR29956', 'MRN'), ('4836409447809950', 'CREDIT'), ('221-609-9328x151', 'PHONE')]",1,1,1,1
"The subject of this confidential report, holding the driver's license AZ J71867379, resides at 16468 Lisa Oval, Lutzmouth, NH 37944. The individual is associated with the IP address 30.149.100.33 and possesses passport number 771499792. Additionally, the vehicle registered under the license plate MMQ-9813 is linked to this profile. This information is intended for internal use only and should be handled with the utmost confidentiality.","[('AZ J71867379', 'DL'), ('771499792', 'PASSPORT'), ('30.149.100.33', 'IP'), ('MMQ-9813', 'PLATE'), ('16468 Lisa Oval, Lutzmouth, NH 37944', 'ADDRESS')]","[('AZ J71867379', 'DL'), ('16468 Lisa Oval, Lutzmouth, NH 37944', 'ADDRESS'), ('30.149.100.33', 'IP'), ('771499792', 'PASSPORT'), ('MMQ-9813', 'PLATE')]",1,1,1,1
"Jordan Thompson is a vibrant individual with a passion for adventure and a knack for making friends wherever they go. With a colorful personality, they often drive around town in their sleek car, proudly displaying the license plate ERJ-6136. Jordan is a meticulous planner, as reflected in their impressive organizational skills, which help them keep track of important documents like their passport (923258064) and driver’s license (SD L59857656). Financially savvy, Jordan also manages their expenses with a credit card (4488262138587992) that supports their spontaneous travels. Always up for a new experience, Jordan is the life of the party!","[('SD L59857656', 'DL'), ('923258064', 'PASSPORT'), ('4488262138587992', 'CREDIT'), ('ERJ-6136', 'PLATE')]","[('ERJ-6136', 'PLATE'), ('923258064', 'PASSPORT'), ('SD L59857656', 'DL'), ('4488262138587992', 'CREDIT')]",1,1,1,1
"So, at the party last weekend, everyone was chatting about their wildest travel stories, and then someone brought up the time when Alex Harper had to rush to get his passport renewed. Turns out, he was born on January 2, 1993, which makes him a true Capricorn, and he loves to plan spontaneous trips. He joked about how his passport number, 874729278, could tell a few tales of its own! We laughed about the time he lost his wallet with his SSN—350-18-4454—right before a huge trip. But, hey, that's just Alex being Alex. Always the adventurer!","[('874729278', 'PASSPORT'), ('350-18-4454', 'SSN')]","[('874729278', 'PASSPORT')]",1,0.5,0.67,0.5
"Alex Thompson is a dedicated professional with a strong background in project management and operational excellence. Currently employed under the ID E61510, Alex has consistently demonstrated exceptional problem-solving skills and leadership capabilities. With a keen attention to detail, Alex manages projects efficiently, always striving for high-quality outcomes. Known for a proactive approach, Alex fosters collaboration within teams to enhance productivity. Additionally, Alex holds a valid passport (225257763) and is recognized for maintaining comprehensive records, including an MRN of MR41011. For inquiries, Alex can be reached at 896-944-0830x14292.","[('225257763', 'PASSPORT'), ('E61510', 'EMP'), ('896-944-0830x14292', 'PHONE'), ('MR41011', 'MRN')]","[('E61510', 'EMP'), ('225257763', 'PASSPORT'), ('MR41011', 'MRN'), ('896-944-0830x14292', 'PHONE')]",1,1,1,1
"This identity verification summary reflects the background of an individual born on July 16, 1975, residing at 3143 Emily Stream, Connorside, SC 04031. The individual's unique identifier includes an IP address of 32.147.182.87 and a Social Security Number (SSN) of 198-23-5667. Additionally, financial records indicate a credit card number of 4610-1685-1607-5776, while the biometric identifier is noted as BD07600. This summary encompasses essential information for verification purposes.","[('32.147.182.87', 'IP'), ('198-23-5667', 'SSN'), ('BD07600', 'BIO'), ('3143 Emily Stream, Connorside, SC 04031', 'ADDRESS')]","[('3143 Emily Stream, Connorside, SC 04031', 'ADDRESS'), ('32.147.182.87', 'IP'), ('198-23-5667', 'SSN'), ('BD07600', 'BIO')]",1,1,1,1
"John Smith, with the employee number E33008, is located at 024 Crystal Row, New Jamesstad, CA 56859. He can be reached via phone at (874) 874-4613. His Social Security Number is 213-20-7830, and he holds the passport number 458038094. All provided information is accurate and up to date, ensuring compliance with internal record-keeping requirements.","[('458038094', 'PASSPORT'), ('213-20-7830', 'SSN'), ('024 Crystal Row, New Jamesstad, CA 56859', 'ADDRESS'), ('E33008', 'EMP')]","[('E33008', 'EMP'), ('024 Crystal Row, New Jamesstad, CA 56859', 'ADDRESS'), ('213-20-7830', 'SSN'), ('458038094', 'PASSPORT')]",1,1,1,1
