Sentence,Ground Truth Entities,Model Predicted Entities,Precision,Recall,F1 Score,IoU
"At a lively party last weekend, friends were swapping funny stories when someone brought up their travel mishaps. Alex Turner chimed in, recalling how his passport number, 606262951, almost got him denied boarding for a trip. He was born on March 9, 1998, and his friends couldn't believe he was already old enough to have had such adventures! Laughter erupted when he mentioned how he'd accidentally shared his IP address, 222.17.192.99, with a stranger while trying to troubleshoot a tech issue. The night took a wild turn when someone jokingly read off his VIN, Z56LM2TPFZE9M4PSS, thinking it was some secret code. What a memorable night!","[('606262951', 'PASSPORT'), ('Z56LM2TPFZE9M4PSS', 'VIN'), ('222.17.192.99', 'IP')]","[('606262951', 'PASSPORT'), ('222.17.192.99', 'IP'), ('Z56LM2TPFZE9M4PSS', 'VIN')]",1,1,1,1
"At the last team gathering, everyone had a good laugh while sharing stories about unique finds. Someone mentioned how memorable it was when they found out about the quirky license plate, PPL-3535, belonging to the always-engaging individual with the phone number (215)792-5006. The conversation shifted to Mr. N's medical record number, MR76326, and some even joked about the VIN 8DVE861RAMCJTVURY that comes with their cool car. It turns out they also have a passport, number 764603809, that has seen quite a bit of the world. A fun bio, BD09158, adds to the mystery of this fascinating person!","[('(215)792-5006', 'PHONE'), ('BD09158', 'BIO'), ('8DVE861RAMCJTVURY', 'VIN'), ('764603809', 'PASSPORT'), ('MR76326', 'MRN'), ('PPL-3535', 'PLATE')]","[('PPL-3535', 'PLATE'), ('(215)792-5006', 'PHONE'), ('MR76326', 'MRN'), ('8DVE861RAMCJTVURY', 'VIN'), ('764603809', 'PASSPORT'), ('BD09158', 'BIO')]",1,1,1,1
"I'm sorry, but I can't assist with that.",[],[],0,0,0,0
"Have you heard about the new neighbor at 4567 Wilkins Highway? They moved into apartment 403 and seem like a really nice person! Their name is on the mail, but everyone just calls them by their first name. They’ve got this charming car with the plate AMN-3717, and I swear, it’s always parked out front. The other day, I saw them chatting on the phone—something about MRN 53467, which sounded a bit puzzling at first! Anyway, it’s great to have someone new in North Kristenbury, and they seem to fit right in with the community.","[('AMN-3717', 'PLATE')]","[('AMN-3717', 'PLATE')]",1,1,1,1
"Katherine Summers was born on November 10, 1965. She is currently employed under the identifier E30205. Katherine has demonstrated a consistent level of professionalism and dedication throughout her tenure with the organization. Her employee VIN is HLJREYC2SVAZ743MH, which is recorded for internal tracking purposes. Katherine's contributions to the team have been valuable, and she is recognized for her collaborative spirit and problem-solving skills. She continues to be an integral part of the organization’s success.","[('E30205', 'EMP'), ('Katherine Summers', 'NAME'), ('HLJREYC2SVAZ743MH', 'VIN')]","[('Katherine Summers', 'NAME'), ('E30205', 'EMP'), ('HLJREYC2SVAZ743MH', 'VIN')]",1,1,1,1
"This profile presents a formal summary for an application. The candidate resides at 446 Clay Squares Apt. 221 in Lake Nancy, AL 73055 and can be reached at 251-730-4387, extension 32224. The employment ID is E62554, and the individual holds a Wyoming driver's license with the number u83496938. Additional identifying information includes a bio ID of BD33683 and a vehicle identification number (VIN) of Y785SWSW8SKJSLZCL. This comprehensive information supports the candidate's application.","[('Y785SWSW8SKJSLZCL', 'VIN'), ('BD33683', 'BIO'), ('E62554', 'EMP')]","[('E62554', 'EMP'), ('BD33683', 'BIO'), ('Y785SWSW8SKJSLZCL', 'VIN')]",1,1,1,1
"So, there’s this intriguing character named BD09905, who was born on November 8, 1999. Apparently, they’ve got a credit card with the number 4716766372878226, which seems a bit much to be sharing, but that’s just the start. They drive around in a car with the plate DAX-1138 and hold a driver's license with the number PW n33283952. Rumor has it that they live at 4799 Melissa Rapids in West Josephfurt, VI 20749. Quite the mysterious presence in the neighborhood, if you ask me!","[('BD09905', 'BIO'), ('DAX-1138', 'PLATE'), ('PW n33283952', 'DL'), ('4716766372878226', 'CREDIT')]","[('BD09905', 'BIO'), ('4716766372878226', 'CREDIT'), ('DAX-1138', 'PLATE'), ('PW n33283952', 'DL')]",1,1,1,1
"At 73 years old, Frank Thompson has made a lasting impact on his community in Amandaborough, Nevada. Residing at 407 Price Causeway Apt. 318, Frank has built a reputation for his kindness and reliability. His neighbors often seek him out for advice or assistance, appreciating his wisdom and experience. He has a keen interest in classic cars, particularly the one with VIN KTP2JN0YUUEPP959F that he often restores in his garage. With a history tied to his MRN MR97623, Frank's life is a tapestry of engaging stories and heartfelt connections, all originating from his humble beginnings on November 11, 1950. His presence in the neighborhood is truly cherished!","[('MR97623', 'MRN'), ('KTP2JN0YUUEPP959F', 'VIN')]","[('KTP2JN0YUUEPP959F', 'VIN'), ('MR97623', 'MRN')]",1,1,1,1
"BD96054 is a dedicated professional born on April 7, 1956. They are currently located at 0102 Boone Ports Suite 964, New Deborah, NY 97896. BD96054 can be reached at the phone number 560.563.4345. Their passport number is 867545896, and their vehicle identification number (VIN) is Y7SN467FJPGDC3JWB. BD96054 has consistently demonstrated commitment and reliability in their role within the organization.","[('560.563.4345', 'PHONE'), ('0102 Boone Ports Suite 964, New Deborah, NY 97896', 'ADDRESS'), ('867545896', 'PASSPORT'), ('Y7SN467FJPGDC3JWB', 'VIN'), ('BD96054', 'BIO')]","[('BD96054', 'BIO'), ('0102 Boone Ports Suite 964, New Deborah, NY 97896', 'ADDRESS'), ('560.563.4345', 'PHONE'), ('867545896', 'PASSPORT'), ('Y7SN467FJPGDC3JWB', 'VIN')]",1,1,1,1
"This background check report provides a summary of the individual associated with the following details. The subject, born on October 19, 1979, resides at 178 Barker Crescent, Lake Rebeccashire, PA 96555. The Social Security Number is 343-71-5639, and the individual holds a passport with the number 428758319. Additionally, the vehicle identification number for the associated automobile is DYUF4T6W7Y6LCZGR8. The individual's credit card number is 4641250031329632. All information has been gathered to ensure a comprehensive understanding of the subject's background.","[('4641250031329632', 'CREDIT'), ('178 Barker Crescent, Lake Rebeccashire, PA 96555', 'ADDRESS'), ('428758319', 'PASSPORT'), ('343-71-5639', 'SSN'), ('DYUF4T6W7Y6LCZGR8', 'VIN')]","[('178 Barker Crescent, Lake Rebeccashire, PA 96555', 'ADDRESS'), ('343-71-5639', 'SSN'), ('428758319', 'PASSPORT'), ('DYUF4T6W7Y6LCZGR8', 'VIN'), ('4641250031329632', 'CREDIT')]",1,1,1,1
"Did you hear about Samuel Larson? Apparently, he lives in Unit 5131, Box 2855 over in that DPO area—can you believe it? People say he’s got quite the busy schedule because he's always on the phone, and I overheard his number is 748-780-5572 ext. 5912. Rumor has it he’s planning something big for next month, but no one really knows what! Some think it’s a party, while others believe he’s up to something more mysterious. Either way, he sure keeps things interesting around here!","[('Samuel Larson', 'NAME')]","[('Samuel Larson', 'NAME')]",1,1,1,1
"John Doe, born on July 10, 1945, is known for his vibrant personality and knack for storytelling. Residing in the Rochester area, he can often be reached at his phone number, (585) 239-3647 ext. 022. With a keen interest in travel, John holds a valid passport, number 155346766, which he frequently updates for his adventurous spirit. His financial savvy is evidenced by his well-managed credit card, 4232 8919 2654 7021. Meanwhile, his medical record number, MR78247, is kept confidential, ensuring his health details remain private. Overall, John is a cherished member of his community, always eager to lend a helping hand!","[('155346766', 'PASSPORT'), ('MR78247', 'MRN')]","[('155346766', 'PASSPORT'), ('MR78247', 'MRN')]",1,1,1,1
"Michael Lee, born on October 20, 1937, has an incredible knack for storytelling that captivates everyone around him. After returning from a recent trip, friends couldn't stop talking about how he regaled them with tales of his adventures. Whether it was his encounters with local culture or the stunning landscapes he explored, Michael's vibrant personality shone through every anecdote. His keen sense of humor and warmth made the trip even more memorable for those who joined him. Michael Lee continues to inspire others with his zest for life and his ability to share experiences in such a relatable way!","[('Michael Lee', 'NAME')]","[('Michael Lee', 'NAME')]",1,1,1,1
"This document summarizes the relevant details for the formal application associated with the individual identified by MRN: MR62720. The applicant is registered under the vehicle plate number KKI-1471. For identification purposes, the Social Security Number is recorded as 625-02-1750. Communication can be established via the provided phone number: +1-418-301-6683x693. All information herein is essential for processing the application efficiently and ensuring compliance with institutional requirements.","[('MR62720', 'MRN'), ('+1-418-301-6683x693', 'PHONE'), ('KKI-1471', 'PLATE'), ('625-02-1750', 'SSN')]","[('MR62720', 'MRN'), ('KKI-1471', 'PLATE'), ('625-02-1750', 'SSN'), ('+1-418-301-6683x693', 'PHONE')]",1,1,1,1
"Jordan Smith is an employee identified by the number E05063, born on December 18, 1992. He holds a passport with the number 987878136 and a Wisconsin driver's license (DL) number WI I50679949. Jordan's vehicle is registered with the license plate GPZ-9527. He currently resides at PSC 0360, Box 2020, APO AA 34470. Jordan is known for his diligence and strong work ethic, making him a valuable asset to the team!","[('PSC 0360, Box 2020, APO AA 34470', 'ADDRESS'), ('E05063', 'EMP'), ('WI I50679949', 'DL'), ('GPZ-9527', 'PLATE'), ('987878136', 'PASSPORT')]","[('E05063', 'EMP'), ('987878136', 'PASSPORT'), ('WI I50679949', 'DL'), ('GPZ-9527', 'PLATE'), ('PSC 0360, Box 2020, APO AA 34470', 'ADDRESS')]",1,1,1,1
"James Thompson, residing at 9542 Brittany Key Suite 875 in West Tammymouth, KY, has been a valued team member since his employment began under the ID E70416. Born on November 24, 1939, he brings a wealth of experience to the workplace. Colleagues often appreciate his reliable communication, reachable at 917-216-4675. His dedication and professionalism shine through in every task he undertakes, making him a respected figure in the office. With vehicle plate AJD-2217, he balances work and personal life effortlessly.","[('E70416', 'EMP'), ('AJD-2217', 'PLATE')]","[('E70416', 'EMP'), ('AJD-2217', 'PLATE')]",1,1,1,1
"I'm sorry, but I can't assist with that.",[],[],0,0,0,0
"Kevin Ramos is a remarkable individual who recently returned from a memorable trip to the mountains. Born on November 8, 1943, he has a youthful spirit that belies his age. During the journey, he drove his trusty car, with the license plate EIS-1098, showcasing his pride in ownership. Friends fondly recall his infectious laughter echoing through the trails as they explored breathtaking vistas together. Living at 33217 Gina Avenue in Jennifertown, SC, Kevin's adventurous spirit shines through in all he does. His stories from the trip are sure to inspire future adventures!","[('EIS-1098', 'PLATE'), ('Kevin Ramos', 'NAME')]","[('Kevin Ramos', 'NAME'), ('EIS-1098', 'PLATE')]",1,1,1,1
"George Wilson, identified by bio BD77178, is a professional known for his expertise in his field. He operates with the plate number POT-2794 and can be contacted via phone at 001-257-991-1992x791. His digital footprint is associated with IP address 95.235.62.153, highlighting his online presence. Additionally, he is linked to employment ID E54766, which further establishes his professional credentials. George's attention to detail and reliability make him a valuable asset in any endeavor.","[('POT-2794', 'PLATE'), ('George Wilson', 'NAME'), ('E54766', 'EMP'), ('001-257-991-1992x791', 'PHONE'), ('BD77178', 'BIO'), ('95.235.62.153', 'IP')]","[('George Wilson', 'NAME'), ('BD77178', 'BIO'), ('POT-2794', 'PLATE'), ('001-257-991-1992x791', 'PHONE'), ('95.235.62.153', 'IP'), ('E54766', 'EMP')]",1,1,1,1
"The individual identified by the Social Security Number 002-63-4098 is associated with employee number E59591. Current contact information includes a phone number at (319) 989-0309, extension 2486. The individual's residential address is recorded as 204 Adam Valleys Apt. 284, Holtmouth, AL 85494. All provided information is pertinent to maintaining accurate records and ensuring effective communication within the relevant departmental framework.","[('002-63-4098', 'SSN'), ('204 Adam Valleys Apt. 284, Holtmouth, AL 85494', 'ADDRESS'), ('E59591', 'EMP')]","[('002-63-4098', 'SSN'), ('E59591', 'EMP'), ('204 Adam Valleys Apt. 284, Holtmouth, AL 85494', 'ADDRESS')]",1,1,1,1
"This profile pertains to an individual born on July 16, 1941, with employee number E44714 and medical record number MR61606. The person's driver's license, identified as TN t90243175, reflects their commitment to maintaining valid credentials. They are associated with vehicle plate KFU-1385, further establishing their identity. It is crucial to ensure that all personal information, including Social Security Number 293-92-3637, is handled with confidentiality and care during formal applications.","[('TN t90243175', 'DL'), ('293-92-3637', 'SSN'), ('MR61606', 'MRN'), ('E44714', 'EMP'), ('KFU-1385', 'PLATE')]","[('E44714', 'EMP'), ('MR61606', 'MRN'), ('TN t90243175', 'DL'), ('KFU-1385', 'PLATE'), ('293-92-3637', 'SSN')]",1,1,1,1
"The individual associated with MRN: MR50482 and SSN: 192-43-7311 resides at 66435 Jonathan Loop, New Sara, MP 81943. This address has been verified in relation to various community records. Additionally, the vehicle registered to this individual bears the license plate number DJL-9325. All pertinent details have been documented to ensure a thorough background check process, providing relevant insights into the individual’s identity and residence for institutional purposes.","[('MR50482', 'MRN'), ('DJL-9325', 'PLATE'), ('66435 Jonathan Loop, New Sara, MP 81943', 'ADDRESS'), ('192-43-7311', 'SSN')]","[('MR50482', 'MRN'), ('192-43-7311', 'SSN'), ('66435 Jonathan Loop, New Sara, MP 81943', 'ADDRESS'), ('DJL-9325', 'PLATE')]",1,1,1,1
"In the neighborhood, there's a resident born on September 23, 2001, who is known for their friendly demeanor. With a driver's license number NM H90706922, they can often be seen driving around in their vehicle, proudly displaying the license plate OBC-3264. This individual can be reached at the phone number (896) 339-0806 x8439, which many neighbors have saved for quick communication. They also have a medical record number of MR68985, showcasing their presence in local healthcare systems. Their responsible nature extends to managing their finances, as evidenced by their credit card number, 4634 5717 7934 4650. Overall, this resident is a well-regarded member of the community!","[('OBC-3264', 'PLATE'), ('NM H90706922', 'DL'), ('MR68985', 'MRN')]","[('NM H90706922', 'DL'), ('OBC-3264', 'PLATE'), ('MR68985', 'MRN')]",1,1,1,1
"[Individual's Name] is a dedicated professional residing at 036 Jackson Square Apt. 060, Martinezberg, ME 80376. With a strong background in their field, [Individual's Name] has demonstrated exceptional skills and a commitment to excellence. The individual's credibility is supported by a valid driver's license (IA W81458708) and a unique Social Security Number (326-92-8382). Additionally, [Individual's Name] holds a financial credit record indicated by the number 4973350670204274 and a vehicle identification number (VIN: E11RCTM6RC0VF35MT) reflecting responsible ownership. Overall, [Individual's Name] is a valuable asset to any organization.","[('4973350670204274', 'CREDIT'), ('036 Jackson Square Apt. 060, Martinezberg, ME 80376', 'ADDRESS'), ('326-92-8382', 'SSN'), ('IA W81458708', 'DL'), ('E11RCTM6RC0VF35MT', 'VIN')]","[('036 Jackson Square Apt. 060, Martinezberg, ME 80376', 'ADDRESS'), ('IA W81458708', 'DL'), ('326-92-8382', 'SSN'), ('4973350670204274', 'CREDIT'), ('E11RCTM6RC0VF35MT', 'VIN')]",1,1,1,1
"Jordan Lee is a resident of North Caitlin, Alaska, living at 37725 Dominique Ports. Known for being resourceful, Jordan can often be reached at (354) 933-8137, extension 05107. With a solid work ethic, Jordan maintains a steady financial profile, evidenced by a credit card number ending in 7641. Additionally, Jordan has a medical record number MR56316, which suggests a history of regular check-ups. Overall, Jordan seems to balance a busy lifestyle while keeping everything organized and under control.","[('MR56316', 'MRN')]","[('MR56316', 'MRN')]",1,1,1,1
"The background check report for the individual reveals the following details: The person is associated with the IP address 116.20.155.89 and is linked to the vehicle with the license plate MGL-3300. Communication can be made via the phone number (938)564-2688x22893. Additionally, their Social Security Number is 257-24-3779. The individual resides at the address 5820 Tamara Glen, South Johnny, ID 06727. These details are critical for further verification and assessment of the individual’s background.","[('5820 Tamara Glen, South Johnny, ID 06727', 'ADDRESS'), ('MGL-3300', 'PLATE'), ('116.20.155.89', 'IP'), ('257-24-3779', 'SSN'), ('(938)564-2688x22893', 'PHONE')]","[('116.20.155.89', 'IP'), ('MGL-3300', 'PLATE'), ('(938)564-2688x22893', 'PHONE'), ('257-24-3779', 'SSN'), ('5820 Tamara Glen, South Johnny, ID 06727', 'ADDRESS')]",1,1,1,1
"At the bustling office in South Michael, Montana, nestled in Suite 449 of the Christopher Mountains, a diligent employee named Marcus had an important task ahead. With his MRN, MR06282, and a unique bio, BD03078, he prepared to process a crucial transaction. As Marcus entered the credit card number, 4562235001931587, into the secure system, he felt a surge of responsibility. His employment identifier, E81074, reminded him of the commitment to accuracy and efficiency. That day was just another reminder of the role he played in supporting the organization and ensuring everything ran smoothly!","[('E81074', 'EMP'), ('BD03078', 'BIO'), ('MR06282', 'MRN'), ('4562235001931587', 'CREDIT')]","[('MR06282', 'MRN'), ('BD03078', 'BIO'), ('4562235001931587', 'CREDIT'), ('E81074', 'EMP')]",1,1,1,1
"Everyone knows Michael Harrison, the go-to guy in the office for tech support. Born on May 3, 1982, he has a knack for solving problems and always seems to be connected—his desk phone number is even +1-673-482-4164x42976! When he's not helping out coworkers, he’s usually found tinkering with gadgets or coding away on his laptop with the IP address 130.120.157.66. His employee number is E19427, and he’s really someone you can rely on. Just don’t ask him for any personal information like his social security number—he's not sharing that!","[('130.120.157.66', 'IP'), ('+1-673-482-4164x42976', 'PHONE'), ('E19427', 'EMP')]","[('+1-673-482-4164x42976', 'PHONE'), ('130.120.157.66', 'IP'), ('E19427', 'EMP')]",1,1,1,1
"Did you hear about Jillian Barnes? Apparently, she’s been quite the topic lately! Born on December 4, 1989, she’s really making waves in her PR career. Some folks say her phone number is 267-921-3102, and she even recently traveled abroad using her passport, number 317667348. There’s also talk about her credit card, ending in 0799, which she apparently used for a big purchase last week. It’s wild how her life just keeps getting more interesting! Can you believe it?","[('317667348', 'PASSPORT'), ('267-921-3102', 'PHONE'), ('Jillian Barnes', 'NAME')]","[('Jillian Barnes', 'NAME'), ('267-921-3102', 'PHONE'), ('317667348', 'PASSPORT')]",1,1,1,1
"Robert Holt, born on March 9, 1951, is quite the character in the neighborhood. Known for his infectious laugh and friendly demeanor, he often shares stories from his days working at the local factory, where his employee number was E85818. Just the other day, he was reminiscing about how he met his wife while working there. With a phone number like +1-351-486-6157x247, Robert is always just a call away for a chat or a game of cards. He's the kind of neighbor who makes everyone feel welcome and is always ready to lend a hand or share a laugh!","[('Robert Holt', 'NAME'), ('E85818', 'EMP'), ('+1-351-486-6157x247', 'PHONE')]","[('Robert Holt', 'NAME'), ('E85818', 'EMP'), ('+1-351-486-6157x247', 'PHONE')]",1,1,1,1
"The individual in question, born on February 10, 1963, has been assigned the Social Security Number 146-84-7898. Their unique identification code is BD47180, which may be relevant for internal records. Additionally, the vehicle registered under their name bears the license plate WWO-4749. This information may assist in further verification processes or background checks as needed.","[('BD47180', 'BIO'), ('146-84-7898', 'SSN'), ('WWO-4749', 'PLATE')]","[('146-84-7898', 'SSN'), ('BD47180', 'BIO'), ('WWO-4749', 'PLATE')]",1,1,1,1
"The individual associated with the VIN 3MW9Z5F7T5KSGL3E5 has been identified with the Social Security Number 380-37-8811. This person’s biography is recorded under the ID BD94706. Additionally, they possess a credit account with the number 4034971980594695. All relevant information has been compiled to facilitate further review and ensure compliance with regulatory requirements. This summary serves to provide essential identification details for administrative purposes.","[('380-37-8811', 'SSN'), ('BD94706', 'BIO'), ('4034971980594695', 'CREDIT'), ('3MW9Z5F7T5KSGL3E5', 'VIN')]","[('3MW9Z5F7T5KSGL3E5', 'VIN'), ('380-37-8811', 'SSN'), ('BD94706', 'BIO'), ('4034971980594695', 'CREDIT')]",1,1,1,1
"The individual associated with the vehicle plate ZBW-4685 holds a passport numbered 897439194 and a Texas driver's license with the ID t62024089. Employed under the designation E80305, this person has a biometric ID marked as BD45424. Their current residence is located at 0432 Alexis Coves, South Ashley, GA 97281.","[('BD45424', 'BIO'), ('0432 Alexis Coves, South Ashley, GA 97281', 'ADDRESS'), ('ZBW-4685', 'PLATE'), ('897439194', 'PASSPORT'), ('E80305', 'EMP')]","[('ZBW-4685', 'PLATE'), ('897439194', 'PASSPORT'), ('E80305', 'EMP'), ('BD45424', 'BIO'), ('0432 Alexis Coves, South Ashley, GA 97281', 'ADDRESS')]",1,1,1,1
"During the recent trip, everyone was charmed by Emily Carter's upbeat personality and adventurous spirit. Known for her infectious laughter, Emily navigated every new city with enthusiasm, making friends wherever she went. Her organizational skills were evident as she kept track of important details, like her passport number 942861800, ensuring everything went smoothly. She also made sure to keep her phone handy at 467.231.4923x62837 for any last-minute plans. With her knack for gathering experiences, Emily truly made the trip unforgettable. Her knack for details, even including her MRN MR65133, highlights her careful nature, but it’s her joyful attitude that everyone will remember!","[('942861800', 'PASSPORT'), ('MR65133', 'MRN'), ('467.231.4923x62837', 'PHONE')]","[('942861800', 'PASSPORT'), ('467.231.4923x62837', 'PHONE'), ('MR65133', 'MRN')]",1,1,1,1
"This character reference is provided for an individual whose vehicle registration is IPV-4723 and employee identification number is E85791. The individual possesses a valid passport with the number 294432495, and their internet protocol address is 201.76.133.65. These details may assist in verifying the identity and professional background of the individual in question. This reference is offered in good faith and with confidence in the character of the individual.","[('201.76.133.65', 'IP'), ('E85791', 'EMP'), ('294432495', 'PASSPORT'), ('IPV-4723', 'PLATE')]","[('IPV-4723', 'PLATE'), ('E85791', 'EMP'), ('294432495', 'PASSPORT'), ('201.76.133.65', 'IP')]",1,1,1,1
"Rebecca Bell is a vibrant and dynamic individual known for her adventurous spirit. With a unique identifier of MRN: MR76443, Rebecca also carries the EMP: E10706 in her professional dealings. Her Texas driver's license, DL: TX c66053154, reflects her roots in the Lone Star State, while her social security number, SSN: 083-03-4438, underscores her commitment to community and personal growth. Rebecca's passport number, 850852171, hints at her love for travel and exploration, often seeking new cultures and experiences. Overall, Rebecca Bell is a person who embraces life with enthusiasm and curiosity!","[('MR76443', 'MRN'), ('Rebecca Bell', 'NAME'), ('850852171', 'PASSPORT'), ('083-03-4438', 'SSN'), ('E10706', 'EMP'), ('TX c66053154', 'DL')]","[('Rebecca Bell', 'NAME'), ('MR76443', 'MRN'), ('E10706', 'EMP'), ('TX c66053154', 'DL'), ('083-03-4438', 'SSN'), ('850852171', 'PASSPORT')]",1,1,1,1
"On July 10, 1959, BD94701 was born and has since maintained a steady presence in his community. He is identified by SSN 606-93-4294 and is currently employed under the designation E96473. Throughout his life, BD94701 has demonstrated commitment and reliability, which is also reflected in his driving record associated with DL ID A45053477. This combination of professional dedication and personal stability marks BD94701 as a valuable member of society, contributing positively to those around him.","[('E96473', 'EMP'), ('ID A45053477', 'DL'), ('BD94701', 'BIO'), ('606-93-4294', 'SSN')]","[('BD94701', 'BIO'), ('606-93-4294', 'SSN'), ('E96473', 'EMP'), ('ID A45053477', 'DL')]",1,1,1,1
"I'm sorry, but I can't assist with that.",[],[],0,0,0,0
